uniq_id,crawl_timestamp,product_url,product_name,product_category_tree,pid,retail_price,discounted_price,image,is_FK_Advantage_product,description,product_rating,overall_rating,brand,product_specifications
ea2406dc597bee2abb6b867fa668501f,2016-06-24 16:24:13 +0000,http://www.flipkart.com/tiara-diaries-2016-2017-designer-la-kaarta-taking-action-getting-result-set-3-b5-notebook-hard-bound/p/itmej8fgzwbenga9?pid=DIAEJ8FGHZ3K86JU,"Tiara Diaries 2016-2017 Designer LA Kaarta ""TAKING ACTION GETTING RESULT"" (Set of 3) B5 Notebook Hard Bound","[""Pens & Stationery >> Diaries & Notebooks >> Notebooks >> Designer >> Tiara Diaries Designer >> Tiara Diaries 2016-2017 Designer LA Kaarta \""TAKI...""]",DIAEJ8FGHZ3K86JU,1000,837,"[""http://img6a.flixcart.com/image/diary-notebook/6/j/u/tiara-diaries-244-original-imaej4qrfnczpn8k.jpeg"", ""http://img5a.flixcart.com/image/diary-notebook/6/j/u/tiara-diaries-244-original-imaej4qrfnczpn8k.jpeg""]",false,"Specifications of Tiara Diaries 2016-2017 Designer LA Kaarta ""TAKING ACTION GETTING RESULT"" (Set of 3) B5 Notebook Hard Bound (Coffee, Pack of 3) General Ruling ruled Model id 244 Type Notebook No. of Pages 216 Brand Name Tiara Diaries Binding Hard Bound Size B5 Color Coffee",No rating available,No rating available,Tiara Diaries,"{""product_specification""=>[{""key""=>""Ruling"", ""value""=>""ruled""}, {""key""=>""Model id"", ""value""=>""244""}, {""key""=>""Type"", ""value""=>""Notebook""}, {""key""=>""No. of Pages"", ""value""=>""216""}, {""key""=>""Brand Name"", ""value""=>""Tiara Diaries""}, {""key""=>""Binding"", ""value""=>""Hard Bound""}, {""key""=>""Size"", ""value""=>""B5""}, {""key""=>""Color"", ""value""=>""Coffee""}]}"
5935ed077915347dc695744df68c565c,2016-03-03 07:19:26 +0000,http://www.flipkart.com/kajci-embroidered-women-s-waistcoat/p/itmeg2fyaezq59fn?pid=WSCEG2FYDYFDSVZ6,KAJCI Embroidered Women's Waistcoat,"[""Clothing >> Women's Clothing >> Formal Wear >> Waistcoats >> KAJCI Waistcoats >> KAJCI Embroidered Women's Waistcoat""]",WSCEG2FYDYFDSVZ6,1200,699,"[""http://img5a.flixcart.com/image/waistcoat/v/z/6/lkod112-kajci-free-original-imaefwvnru9yxeee.jpeg"", ""http://img5a.flixcart.com/image/waistcoat/v/z/6/lkod112-kajci-free-original-imaefwvngrpzz7hf.jpeg"", ""http://img6a.flixcart.com/image/waistcoat/v/z/6/lkod112-kajci-free-original-imaefwvzfnbfqskk.jpeg"", ""http://img5a.flixcart.com/image/waistcoat/v/z/6/lkod112-kajci-free-original-imaefwvpj9z63znz.jpeg""]",false,Specifications of KAJCI Embroidered Women's Waistcoat General Details Pattern Embroidered Ideal For Women's Waistcoat Details Fabric Art Silk In the Box Waistcoat Additional Details Style Code LKOD112 Fabric Care Dry Clean Only,No rating available,No rating available,KAJCI,"{""product_specification""=>[{""key""=>""Pattern"", ""value""=>""Embroidered""}, {""key""=>""Ideal For"", ""value""=>""Women's""}, {""key""=>""Fabric"", ""value""=>""Art Silk""}, {""value""=>""Waistcoat""}, {""key""=>""Style Code"", ""value""=>""LKOD112""}, {""value""=>""Dry Clean Only""}]}"
89fcdddaad50084e395d0928a7426afe,2016-03-03 07:19:26 +0000,http://www.flipkart.com/packman-8-x-10-inches-security-bags-without-pod-jacket-courier-bag/p/itmegbtrgzn3hzbc?pid=PKBEGBTRKKHU26YQ,Packman 8 x 10 inches Security Bags Without POD Jacket Courier Bag Security Bag,"[""Pens & Stationery >> Office Supplies >> Packaging Security Bags >> Packman Packaging Security Bags >> Packman 8 x 10 inches Security Bags Without POD ...""]",PKBEGBTRKKHU26YQ,350,298,"[""http://img6a.flixcart.com/image/packaging-security-bag/6/y/q/8-x-10-inches-security-bags-without-pod-jacket-courier-bag-1100x1100-imaegbjpxtthuyzc.jpeg"", ""http://img5a.flixcart.com/image/packaging-security-bag/6/y/q/8-x-10-inches-security-bags-without-pod-jacket-courier-bag-original-imaegbjpxtthuyzc.jpeg"", ""http://img6a.flixcart.com/image/packaging-security-bag/6/y/q/8-x-10-inches-security-bags-without-pod-jacket-courier-bag-original-imaegbk8aqxh8fvz.jpeg"", ""http://img6a.flixcart.com/image/packaging-security-bag/6/y/q/8-x-10-inches-security-bags-without-pod-jacket-courier-bag-original-imaegbk87bnggamr.jpeg"", ""http://img5a.flixcart.com/image/packaging-security-bag/6/y/q/8-x-10-inches-security-bags-without-pod-jacket-courier-bag-original-imaegbk8jmty4tfa.jpeg"", ""http://img6a.flixcart.com/image/packaging-security-bag/6/y/q/8-x-10-inches-security-bags-without-pod-jacket-courier-bag-original-imaegbk8qhhq68gd.jpeg""]",false,"Key Features of Packman 8 x 10 inches Security Bags Without POD Jacket Courier Bag Security Bag Supplying to Over 200 Companies around world International E-commerce Standard Direct From ISO 9002 Factory 60 Microns High Quality Bags Longer Lasting Protection,Packman 8 x 10 inches Security Bags Without POD Jacket Courier Bag Security Bag (21.59 x 27.95 Pack of 100) Price: Rs. 298 Courier Bag,Specifications of Packman 8 x 10 inches Security Bags Without POD Jacket Courier Bag Security Bag (21.59 x 27.95 Pack of 100) General Bubble Wrap Present No Brand Packman Model Number 8 x 10 inches Security Bags Without POD Jacket Courier Bag Water Resistant Yes Tamper Proof Yes Material Plastic POD Jacket Available No Color Grey Size 21.59 x 27.95 Dimensions Weight 600 g Other Dimensions 8 x 10 Thickness 60 micron Additional Features Other Features security bag In the Box Sales Package 1 pack contains 100 pcs Pack of 100",No rating available,No rating available,Packman,"{""product_specification""=>[{""key""=>""Bubble Wrap Present"", ""value""=>""No""}, {""key""=>""Brand"", ""value""=>""Packman""}, {""key""=>""Model Number"", ""value""=>""8 x 10 inches Security Bags Without POD Jacket Courier Bag""}, {""key""=>""Water Resistant"", ""value""=>""Yes""}, {""key""=>""Tamper Proof"", ""value""=>""Yes""}, {""key""=>""Material"", ""value""=>""Plastic""}, {""key""=>""POD Jacket Available"", ""value""=>""No""}, {""key""=>""Color"", ""value""=>""Grey""}, {""key""=>""Size"", ""value""=>""21.59 x 27.95""}, {""key""=>""Weight"", ""value""=>""600 g""}, {""key""=>""Other Dimensions"", ""value""=>""8 x 10""}, {""key""=>""Thickness"", ""value""=>""60 micron""}, {""key""=>""Other Features"", ""value""=>""security bag""}, {""key""=>""Sales Package"", ""value""=>""1 pack contains 100 pcs""}, {""key""=>""Pack of"", ""value""=>""100""}]}"
b9b183aa18d3a721d2ac23e7184525b0,2016-03-03 07:19:26 +0000,http://www.flipkart.com/pick-pocket-embroidered-women-s-waistcoat/p/itmefuv4c2beuazq?pid=WSCEFUV4TVWT73ZB,Pick Pocket Embroidered Women's Waistcoat,"[""Clothing >> Women's Clothing >> Formal Wear >> Waistcoats >> Pick Pocket Waistcoats >> Pick Pocket Embroidered Women's Waistcoat""]",WSCEFUV4TVWT73ZB,899,899,"[""http://img6a.flixcart.com/image/waistcoat/d/z/y/tl-012-pick-pocket-xxl-original-imaefurn2xrqf4ef.jpeg"", ""http://img5a.flixcart.com/image/waistcoat/d/z/y/tl-012-pick-pocket-xxl-original-imaefurn2xrqf4ef.jpeg"", ""http://img5a.flixcart.com/image/waistcoat/d/z/y/tl-012-pick-pocket-xxl-original-imaefurnfgxqnfyn.jpeg"", ""http://img5a.flixcart.com/image/waistcoat/d/z/y/tl-012-pick-pocket-xxl-original-imaefurn6tcq3fhz.jpeg"", ""http://img6a.flixcart.com/image/waistcoat/d/z/y/tl-012-pick-pocket-xxl-original-imaefurnjgst7nqg.jpeg""]",false,Specifications of Pick Pocket Embroidered Women's Waistcoat General Details Pattern Embroidered Occasion Casual Ideal For Women's Waistcoat Details Lining Polyester Fabric Bengal Silk Additional Details Style Code TL-012 Fabric Care First Time Dry Clean,No rating available,No rating available,Pick Pocket,"{""product_specification""=>[{""key""=>""Pattern"", ""value""=>""Embroidered""}, {""key""=>""Occasion"", ""value""=>""Casual""}, {""key""=>""Ideal For"", ""value""=>""Women's""}, {""key""=>""Lining"", ""value""=>""Polyester""}, {""key""=>""Fabric"", ""value""=>""Bengal Silk""}, {""key""=>""Style Code"", ""value""=>""TL-012""}, {""value""=>""First Time Dry Clean""}]}"
dee64864c0419bec80fbbb94d19bc40d,2016-03-03 07:19:26 +0000,http://www.flipkart.com/angelfish-silk-potali-potli/p/itmegfyaw849dw9b?pid=PPSEGFYAGD8FYUXV,Angelfish Silk Potali Potli,"[""Bags, Wallets & Belts >> Bags >> Pouches and Potlis >> Angelfish Pouches and Potlis >> Angelfish Silk Potali Potli (Multicolor)""]",PPSEGFYAGD8FYUXV,999,399,"[""http://img6a.flixcart.com/image/pouch-potli/u/x/v/aelkabj01224-a-angelfish-potli-silk-potali-original-imaeeprygdj223es.jpeg"", ""http://img5a.flixcart.com/image/pouch-potli/u/x/v/aelkabj01224-a-angelfish-potli-silk-potali-original-imaeepryxh8xez64.jpeg"", ""http://img6a.flixcart.com/image/pouch-potli/u/x/v/aelkabj01224-a-angelfish-potli-silk-potali-original-imaeeprypmwscfp9.jpeg""]",false,"Angelfish Silk Potali Potli (Multicolor) Price: Rs. 399 Made by silk Fabric with fancy lace adnored and stylish handle also.(set of 2 piece),Specifications of Angelfish Silk Potali Potli (Multicolor) General Closure Velcro Type Potli Material Fabric Style Code AELKABJ01224-A Ideal For Girls Bag Size Small Occasion Party Color Code Multicolor Dimensions Weight 200 g Body Features Number of Compartments 1",No rating available,No rating available,Angelfish,"{""product_specification""=>[{""key""=>""Closure"", ""value""=>""Velcro""}, {""key""=>""Type"", ""value""=>""Potli""}, {""key""=>""Material"", ""value""=>""Fabric""}, {""key""=>""Style Code"", ""value""=>""AELKABJ01224-A""}, {""key""=>""Ideal For"", ""value""=>""Girls""}, {""key""=>""Bag Size"", ""value""=>""Small""}, {""key""=>""Occasion"", ""value""=>""Party""}, {""key""=>""Color Code"", ""value""=>""Multicolor""}, {""key""=>""Weight"", ""value""=>""200 g""}, {""key""=>""Number of Compartments"", ""value""=>""1""}]}"
595f55f2c1293f07ea9ec9fa2bb39f46,2016-03-03 07:19:26 +0000,http://www.flipkart.com/oye-boy-s-dungaree/p/itmef2xs6hvnapgy?pid=DRPEF2XSFBAP4SUZ,Oye Boy's Dungaree,"[""Clothing >> Kids' Clothing >> Boys Wear >> Dungarees & Jumpsuits >> Dungarees >> Oye Dungarees >> Oye Boy's Dungaree""]",DRPEF2XSFBAP4SUZ,899,764,"[""http://img6a.flixcart.com/image/dungaree-romper/9/z/d/bpr0015-oye-1-2-years-original-imaeeyu6ashttgyv.jpeg"", ""http://img5a.flixcart.com/image/dungaree-romper/9/z/d/bpr0015-oye-1-2-years-original-imaeeyu6ashttgyv.jpeg"", ""http://img6a.flixcart.com/image/dungaree-romper/9/z/d/bpr0015-oye-3-4-years-original-imaeeyu62txzhkhw.jpeg""]",false,Specifications of Oye Boy's Dungaree Top Details Number of Contents in Sales Package Pack of 1 Fabric Cotton Type Dungaree General Details Pattern Solid Ideal For Boy's In the Box 1 Dungaree,No rating available,No rating available,Oye,"{""product_specification""=>[{""key""=>""Number of Contents in Sales Package"", ""value""=>""Pack of 1""}, {""key""=>""Fabric"", ""value""=>""Cotton""}, {""key""=>""Type"", ""value""=>""Dungaree""}, {""key""=>""Pattern"", ""value""=>""Solid""}, {""key""=>""Ideal For"", ""value""=>""Boy's""}, {""value""=>""1 Dungaree""}]}"
547b6585272473ae006bcfbdb47b6ae0,2016-05-26 06:31:26 +0000,http://www.flipkart.com/nuride-canvas-shoes/p/itmegvqbfp7yszy3?pid=SHOEGVQCT2ZSGUHY,Nuride Canvas Shoes,"[""Footwear >> Women's Footwear >> Casual Shoes >> Canvas >> Nuride Canvas Shoes""]",SHOEGVQCT2ZSGUHY,1999,1349,"[""http://img6a.flixcart.com/image/shoe/g/6/e/red-1216-nuride-41-original-imaedsa82yrz5hxu.jpeg"", ""http://img6a.flixcart.com/image/shoe/g/6/e/red-1216-nuride-41-original-imaedsa8ygreggzk.jpeg"", ""http://img5a.flixcart.com/image/shoe/g/6/e/red-1216-nuride-39-original-imaedsa8f2zzjznz.jpeg"", ""http://img5a.flixcart.com/image/shoe/g/6/e/red-1216-nuride-39-original-imaedsa8yzndmtkm.jpeg"", ""http://img5a.flixcart.com/image/shoe/g/6/e/red-1216-nuride-39-original-imaegx3k2xhzgwak.jpeg""]",false,"Key Features of Nuride Canvas Shoes Material: Canvas Occasion: Casual Color: Red Heel Height: 0.5,Specifications of Nuride Canvas Shoes General Occasion Casual Ideal For Women Shoe Details Heel Height 0.5 inch Outer Material Canvas Color Red",No rating available,No rating available,Nuride,"{""product_specification""=>[{""key""=>""Occasion"", ""value""=>""Casual""}, {""key""=>""Ideal For"", ""value""=>""Women""}, {""key""=>""Heel Height"", ""value""=>""0.5 inch""}, {""key""=>""Outer Material"", ""value""=>""Canvas""}, {""key""=>""Color"", ""value""=>""Red""}]}"
f6ae9e271a1d4469b4f41124e001e1cc,2016-05-26 06:31:26 +0000,http://www.flipkart.com/om-shivakriti-square-wall-clock-showpiece-38-1-cm/p/itmehs7xbfb3zgca?pid=SHIEHS7XJ954NRYY,OM SHIVAKRITI Square wall Clock Showpiece  -  38.1 cm,"[""Home Decor & Festive Needs >> Showpiece >> Gramophones >> OM SHIVAKRITI Gramophones >> OM SHIVAKRITI Square wall Clock Showpiece  -  38...""]",SHIEHS7XJ954NRYY,1499,1499,"[""http://img6a.flixcart.com/image/showpiece-figurine/r/y/y/osk60-om-shivakriti-original-imaehpu5jajh93bu.jpeg"", ""http://img6a.flixcart.com/image/showpiece-figurine/r/y/y/osk60-om-shivakriti-original-imaehpu5xexmygsk.jpeg""]",false,"Key Features of OM SHIVAKRITI Square wall Clock Showpiece  -  38.1 cm Paper Mache Height - 38.1 cm Width - 38.1 cm,OM SHIVAKRITI Square wall Clock Showpiece  -  38.1 cm (Paper Mache, Multicolor) Price: Rs. 1,499 Omshivakriti brings you this square wall watch made from paper mache and finished in attractive set of colors. The product in display is ideal to décor your home.,Specifications of OM SHIVAKRITI Square wall Clock Showpiece  -  38.1 cm (Paper Mache, Multicolor) General Brand OM SHIVAKRITI Model Number OSK60 Type Antique Material Paper Mache Model Name Square wall Clock Color Multicolor Dimensions Height 38.1 cm Width 38.1 cm Depth 3.81 cm In the Box Sales Package 1 showpiece",No rating available,No rating available,OM SHIVAKRITI,"{""product_specification""=>[{""key""=>""Brand"", ""value""=>""OM SHIVAKRITI""}, {""key""=>""Model Number"", ""value""=>""OSK60""}, {""key""=>""Type"", ""value""=>""Antique""}, {""key""=>""Material"", ""value""=>""Paper Mache""}, {""key""=>""Model Name"", ""value""=>""Square wall Clock""}, {""key""=>""Color"", ""value""=>""Multicolor""}, {""key""=>""Height"", ""value""=>""38.1 cm""}, {""key""=>""Width"", ""value""=>""38.1 cm""}, {""key""=>""Depth"", ""value""=>""3.81 cm""}, {""key""=>""Sales Package"", ""value""=>""1 showpiece""}]}"
f5b22eaa5f79e67209612997f4aa215d,2016-05-26 06:31:26 +0000,http://www.flipkart.com/himmlisch-st381-magnetic-sun-shade-maruti-alto/p/itmejfbryjrhguxk?pid=SUDEJFBRVYEUZUDH,Himmlisch ST381 Magnetic Sun Shade For Maruti Alto,"[""Automotive >> Accessories & Spare parts >> Car Interior & Exterior >> Car Interior >> Car Sun Shades >> Himmlisch ST381 Magnetic Sun Shade For Maruti Al...""]",SUDEJFBRVYEUZUDH,6999,1899,"[""http://img5a.flixcart.com/image/sun-shade/5/2/y/pp48-car-magnetic-himmlisch-1100x1100-imaegujvyzrc8eh6.jpeg"", ""http://img6a.flixcart.com/image/sun-shade/5/2/y/pp48-car-magnetic-himmlisch-original-imaegujvyzrc8eh6.jpeg""]",false,"Himmlisch ST381 Magnetic Sun Shade For Maruti Alto (Side Window) Price: Rs. 1,899 Beat the heat this summer and feel like a VIP with Himmlisch Car Window Magnetic Sunshades. These magnetic sunshades create a mesh layer to stops the heat. Magnet border gets easily stick to your car window door edges (No need of Suction cups) Features: Block UV Rays Keeps Car Cool Easy to install and remove Durable and Exact Fit Provides Complete privacy Resists Heat Mesh Type Sunshade Package Contents: 1 x Set Of 4 Magnetic Sunshades,Specifications of Himmlisch ST381 Magnetic Sun Shade For Maruti Alto (Side Window) General Brand Himmlisch Model Number ST381 Magnetic Placement Position Side Window Color Black Dimensions Weight 4000 g Depth 1.1 cm In the Box Sales Package 4 Sun Shade Pack of 4",No rating available,No rating available,Himmlisch,"{""product_specification""=>[{""key""=>""Brand"", ""value""=>""Himmlisch""}, {""key""=>""Model Number"", ""value""=>""ST381 Magnetic""}, {""key""=>""Placement Position"", ""value""=>""Side Window""}, {""key""=>""Color"", ""value""=>""Black""}, {""key""=>""Weight"", ""value""=>""4000 g""}, {""key""=>""Depth"", ""value""=>""1.1 cm""}, {""key""=>""Sales Package"", ""value""=>""4 Sun Shade""}, {""key""=>""Pack of"", ""value""=>""4""}]}"
e9eb010ed8313f65f0e049fc3fcffe87,2016-04-05 17:56:58 +0000,http://www.flipkart.com/rapter-bnc-179-bnc-wire-connector/p/itmehf8g2gg9efem?pid=WJCEHF8GZSQWZY7Z,Rapter BNC-179 BNC Wire Connector,"[""Tools & Hardware >> Tools >> Hardware & Electricals >> Hardware >> Wire Joints & Connectors >> Rapter BNC-179 BNC Wire Connector (Silver, Pack ...""]",WJCEHF8GZSQWZY7Z,2299,1400,"[""http://img6a.flixcart.com/image/wire-joint-connector/n/r/f/bnc-057-rapter-100-1100x1100-imaehffvdkwk4jzh.jpeg"", ""http://img5a.flixcart.com/image/wire-joint-connector/n/r/f/bnc-057-rapter-100-original-imaehffvdkwk4jzh.jpeg""]",false,"Rapter BNC-179 BNC Wire Connector (Silver, Pack of 100) Price: Rs. 1,400 Rapter Pack of 100 BNC Connector.Superior quality BNC Connectors with high quality outer metel and brass conductors used to maintain a proper video/signal quality.BNC normally used in co-axial cables to lock with female connectors which ensures permanancy of connection.They can be used in DVRs, NVRs and CCTV Cameras etc.,Specifications of Rapter BNC-179 BNC Wire Connector (Silver, Pack of 100) General Brand Rapter Suitable For Wire to Wire Connection, Wire to Circuit Board Connection Model Number BNC-179 Type BNC Waterproof Yes Corrosion Proof Yes Color Silver In the box Sales Package 100 BNC Connector Pack of 100",No rating available,No rating available,Rapter,"{""product_specification""=>[{""key""=>""Brand"", ""value""=>""Rapter""}, {""key""=>""Suitable For"", ""value""=>""Wire to Wire Connection, Wire to Circuit Board Connection""}, {""key""=>""Model Number"", ""value""=>""BNC-179""}, {""key""=>""Type"", ""value""=>""BNC""}, {""key""=>""Waterproof"", ""value""=>""Yes""}, {""key""=>""Corrosion Proof"", ""value""=>""Yes""}, {""key""=>""Color"", ""value""=>""Silver""}, {""key""=>""Sales Package"", ""value""=>""100 BNC Connector""}, {""key""=>""Pack of"", ""value""=>""100""}]}"
6ef0a5eb033cd610d455be7102da5685,2016-04-05 17:56:58 +0000,http://www.flipkart.com/vishudh-printed-women-s-straight-kurta/p/itmehe9h6uejkznn?pid=KTAEHE9HAED4VUQB,Vishudh Printed Women's Straight Kurta,"[""Vishudh Printed Women's Straight Kurta""]",KTAEHE9HAED4VUQB,999,499,"[""http://img5a.flixcart.com/image/kurta/d/s/y/vnku004384-navy-blue-vishudh-xxl-original-imaehdjsznaevbpj.jpeg"", ""http://img6a.flixcart.com/image/kurta/d/s/y/vnku004384-navy-blue-vishudh-xxl-original-imaehdjt7p8hrqp8.jpeg"", ""http://img6a.flixcart.com/image/kurta/h/b/y/vnku004384-navy-blue-vishudh-s-original-imaehdjsvcyp9xz4.jpeg"", ""http://img5a.flixcart.com/image/kurta/h/b/y/vnku004384-navy-blue-vishudh-xxl-original-imaehdjtnmzgqrh9.jpeg"", ""http://img6a.flixcart.com/image/kurta/h/b/y/vnku004384-navy-blue-vishudh-l-original-imaehdjtkyanvavh.jpeg""]",false,"Specifications of Vishudh Printed Women's Straight Kurta Kurta Details Sleeve Sleeveless Number of Contents in Sales Package Pack of 1 Fabric 100% Cotton Type Straight Neck ROUND NECK General Details Pattern Printed Occasion Festive Ideal For Women's In the Box Kurta Additional Details Style Code VNKU004384 NAVY BLUE Fabric Care Gentle Machine Wash in Lukewarm Water, Do Not Bleach",No rating available,No rating available,Vishudh,"{""product_specification""=>[{""key""=>""Sleeve"", ""value""=>""Sleeveless""}, {""key""=>""Number of Contents in Sales Package"", ""value""=>""Pack of 1""}, {""key""=>""Fabric"", ""value""=>""100% Cotton""}, {""key""=>""Type"", ""value""=>""Straight""}, {""key""=>""Neck"", ""value""=>""ROUND NECK""}, {""key""=>""Pattern"", ""value""=>""Printed""}, {""key""=>""Occasion"", ""value""=>""Festive""}, {""key""=>""Ideal For"", ""value""=>""Women's""}, {""value""=>""Kurta""}, {""key""=>""Style Code"", ""value""=>""VNKU004384 NAVY BLUE""}, {""value""=>""Gentle Machine Wash in Lukewarm Water, Do Not Bleach""}]}"
c9c27aa5dc7df49e82e55e8abb6b4020,2016-04-05 17:56:58 +0000,http://www.flipkart.com/vishudh-printed-women-s-straight-kurta/p/itmehe9kzenpyqcp?pid=KTAEHE9KFCMVVSBN,Vishudh Printed Women's Straight Kurta,"[""Vishudh Printed Women's Straight Kurta""]",KTAEHE9KFCMVVSBN,899,449,"[""http://img5a.flixcart.com/image/kurta/s/c/g/vnku004370-pink-olive-vishudh-xxl-original-imaehdjsyzzfv6rj.jpeg"", ""http://img6a.flixcart.com/image/kurta/s/c/g/vnku004370-pink-olive-vishudh-xxl-original-imaehdjscr2pabpv.jpeg"", ""http://img6a.flixcart.com/image/kurta/s/c/g/vnku004370-pink-olive-vishudh-xxl-original-imaehdjsh7zyvbqg.jpeg"", ""http://img5a.flixcart.com/image/kurta/s/c/g/vnku004370-pink-olive-vishudh-xxl-original-imaehdjswgdtvfgp.jpeg"", ""http://img6a.flixcart.com/image/kurta/s/c/g/vnku004370-pink-olive-vishudh-s-original-imaehdjs35fyjzhr.jpeg""]",false,"Specifications of Vishudh Printed Women's Straight Kurta Kurta Details Sleeve Sleeveless Number of Contents in Sales Package Pack of 1 Fabric 100% POLYESTER Type Straight Neck ROUND NECK General Details Pattern Printed Occasion Festive Ideal For Women's In the Box Kurta Additional Details Style Code VNKU004370 PINK::OLIVE Fabric Care Gentle Machine Wash in Lukewarm Water, Do Not Bleach",No rating available,No rating available,Vishudh,"{""product_specification""=>[{""key""=>""Sleeve"", ""value""=>""Sleeveless""}, {""key""=>""Number of Contents in Sales Package"", ""value""=>""Pack of 1""}, {""key""=>""Fabric"", ""value""=>""100% POLYESTER""}, {""key""=>""Type"", ""value""=>""Straight""}, {""key""=>""Neck"", ""value""=>""ROUND NECK""}, {""key""=>""Pattern"", ""value""=>""Printed""}, {""key""=>""Occasion"", ""value""=>""Festive""}, {""key""=>""Ideal For"", ""value""=>""Women's""}, {""value""=>""Kurta""}, {""key""=>""Style Code"", ""value""=>""VNKU004370 PINK::OLIVE""}, {""value""=>""Gentle Machine Wash in Lukewarm Water, Do Not Bleach""}]}"
8bc90f8a2ab89daa6ea69d42fe24c985,2016-04-05 17:56:58 +0000,http://www.flipkart.com/vishudh-printed-women-s-anarkali-kurta/p/itmehe9khxckjhnh?pid=KTAEHE9KEZBBQHYA,Vishudh Printed Women's Anarkali Kurta,"[""Vishudh Printed Women's Anarkali Kurta""]",KTAEHE9KEZBBQHYA,2099,1049,"[""http://img5a.flixcart.com/image/kurta/f/c/4/vnku004389-beige-pink-vishudh-xl-original-imaehdjtwsnkgzvy.jpeg"", ""http://img6a.flixcart.com/image/kurta/f/c/4/vnku004389-beige-pink-vishudh-xl-original-imaehdjtwsnkgzvy.jpeg"", ""http://img6a.flixcart.com/image/kurta/r/s/c/vnku004389-beige-pink-vishudh-m-original-imaehdjtsg2ukrpe.jpeg"", ""http://img5a.flixcart.com/image/kurta/h/a/b/vnku004389-beige-pink-vishudh-s-original-imaehdjtpyzb4ze7.jpeg"", ""http://img5a.flixcart.com/image/kurta/4/s/4/vnku004389-beige-pink-vishudh-s-original-imaehdjtzxjghfxt.jpeg"", ""http://img6a.flixcart.com/image/kurta/h/y/a/vnku004389-beige-pink-vishudh-l-original-imaehdjttyfjwezt.jpeg""]",false,"Specifications of Vishudh Printed Women's Anarkali Kurta Kurta Details Sleeve Half Sleeve Number of Contents in Sales Package Pack of 1 Fabric 100% Cotton Type Anarkali Neck ROUND NECK General Details Pattern Printed Occasion Festive Ideal For Women's In the Box Kurta Additional Details Style Code VNKU004389 BEIGE::PINK Fabric Care Gentle Machine Wash in Lukewarm Water, Do Not Bleach",No rating available,No rating available,Vishudh,"{""product_specification""=>[{""key""=>""Sleeve"", ""value""=>""Half Sleeve""}, {""key""=>""Number of Contents in Sales Package"", ""value""=>""Pack of 1""}, {""key""=>""Fabric"", ""value""=>""100% Cotton""}, {""key""=>""Type"", ""value""=>""Anarkali""}, {""key""=>""Neck"", ""value""=>""ROUND NECK""}, {""key""=>""Pattern"", ""value""=>""Printed""}, {""key""=>""Occasion"", ""value""=>""Festive""}, {""key""=>""Ideal For"", ""value""=>""Women's""}, {""value""=>""Kurta""}, {""key""=>""Style Code"", ""value""=>""VNKU004389 BEIGE::PINK""}, {""value""=>""Gentle Machine Wash in Lukewarm Water, Do Not Bleach""}]}"
