uniq_id,crawl_timestamp,product_url,product_name,product_category_tree,pid,retail_price,discounted_price,image,is_FK_Advantage_product,description,product_rating,overall_rating,brand,product_specifications
849ab05698081a374215d0b7d18047d0,2016-03-25 22:59:23 +0000,http://www.flipkart.com/fabhomedecor-fabric-double-sofa-bed/p/itmeh3qgzgmsuyxn?pid=SBEEH3QGAYAEPRCG,FabHomeDecor Fabric Double Sofa Bed,"[""Furniture >> Living Room Furniture >> Sofa Beds & Futons >> FabHomeDecor Fabric Double Sofa Bed (Finish Colo...""]",SBEEH3QGAYAEPRCG,32157,22646,"[""http://img5a.flixcart.com/image/sofa-bed/r/c/g/fhd132-double-foam-fabhomedecor-purple-purple-1100x1100-imaeh3getyhdnnxn.jpeg"", ""http://img5a.flixcart.com/image/sofa-bed/r/c/g/fhd132-double-foam-fabhomedecor-purple-purple-original-imaeh3getyhdnnxn.jpeg"", ""http://img5a.flixcart.com/image/sofa-bed/r/c/g/fhd132-double-foam-fabhomedecor-purple-purple-original-imaeh3gehkzxd64a.jpeg"", ""http://img6a.flixcart.com/image/sofa-bed/r/c/g/fhd132-double-foam-fabhomedecor-purple-purple-original-imaeh3getztbhygx.jpeg"", ""http://img6a.flixcart.com/image/sofa-bed/r/c/g/fhd132-double-foam-fabhomedecor-purple-purple-original-imaeh3ge5qgadxgh.jpeg"", ""http://img6a.flixcart.com/image/sofa-bed/r/c/g/fhd132-double-foam-fabhomedecor-purple-purple-original-imaeh3gefhxg2vxy.jpeg"", ""http://img5a.flixcart.com/image/sofa-bed/r/c/g/fhd132-double-foam-fabhomedecor-purple-purple-original-imaeh3gfmx3wjstu.jpeg""]",false,"FabHomeDecor Fabric Double Sofa Bed (Finish Color - Purple Mechanism Type - Pull Out) Price: Rs. 22,646 • Fine deep seating experience • Save Space with the all new click clack Sofa Bed • Easy to fold and vice versa with simple click clack mechanism • Chrome legs with mango wood frame for long term durability • Double cushioned Sofa Bed to provide you with extra softness to make a fine seating experience • A double bed that can easily sleep two,Specifications of FabHomeDecor Fabric Double Sofa Bed (Finish Color - Purple Mechanism Type - Pull Out) Installation & Demo Installation & Demo Details Installation and demo for this product is done free of cost as part of this purchase. Our service partner will visit your location within 72 business hours from the delivery of the product. In The Box 1 Sofa Bed General Brand FabHomeDecor Mattress Included No Delivery Condition Knock Down Storage Included No Mechanism Type Pull Out Type Sofa Bed Style Contemporary & Modern Filling Material Microfiber Seating Capacity 3 Seater Upholstery Type NA Upholstery Included No Bed Size Double Shape Square Suitable For Living Room Model Number FHD132 Care Instructions Avoid outdoor use and exposure to water or prolonged moisture, Avoid exposure to direct heat or sunlight as this can cause the sofa colour to fade, Keep sharp objects away from your sofa, A little tear on the fabric cover may be hard to repair, Vacuum your sofas periodically with a soft bristled bru...View More Avoid outdoor use and exposure to water or prolonged moisture, Avoid exposure to direct heat or sunlight as this can cause the sofa colour to fade, Keep sharp objects away from your sofa, A little tear on the fabric cover may be hard to repair, Vacuum your sofas periodically with a soft bristled brush attachment or lightly brush them to keep general dirt and dust off the sofa and prevent any embedding between the fibres, Try to avoid food and drink spillage of any kind, If spills occur, do not leave unattended, In case of a stain, a water-free fabric cleaner can be used, However, avoid applying the cleaner directly on the stain as this can cause damage to the fabric and fade colour, Pour the cleaner onto a clean cloth and test its effect on a hidden area of the sofa before cleaning the stain with the cloth, A professional scotchguard treatment is one of the easiest and most effective options to protect against spills or stains and keep pet hair at bay, Getting your sofa professionally cleaned once every 6-8 months will not only take care of the nooks and corners that you can't reach, it will also make it more durable Finish Type Matte Important Note Cancellation NOT allowed for this product after 24 hrs of order booking. Warranty Covered in Warranty Warranty covers all kind of manufacturing defects. Concerned product will either be repaired or replaced based on discretion. Service Type Manufacturer Warranty Warranty Summary 6 Months Domestic Warranty Not Covered in Warranty Warranty does not cover for Improper Handling Dimensions Weight 40 kg Height 838 mm Width 1905 mm Depth 939 mm Disclaimer - The color of the product may vary slightly compared to the picture displayed on your screen. This is due to lighting, pixel quality and color settings - Please check the product's dimensions to ensure the product will fit in the desired location. Also, check if the product will fit through...View More - The color of the product may vary slightly compared to the picture displayed on your screen. This is due to lighting, pixel quality and color settings - Please check the product's dimensions to ensure the product will fit in the desired location. Also, check if the product will fit through the entrance(s) and door(s) of the premises - Please expect an unevenness of up to 5 mm in the product due to differences in surfaces and floor levels - Flipkart, or the Seller delivering the product, will not take up any type of civil work, such as drilling holes in the wall to mount the product. The product will only be assembled in case carpentry assembly is required - In case the product appears to lack shine, wiping the surface with a cloth will help clear the surface of dust particles Material & Color Upholstery Color Purple Primary Color Purple Primary Material Fabric Secondary Material Subtype Mango Wood Secondary Material Foam Finish Color Purple Primary Material Subtype Foam",No rating available,No rating available,FabHomeDecor,"{""product_specification""=>[{""key""=>""Installation & Demo Details"", ""value""=>""Installation and demo for this product is done free of cost as part of this purchase. Our service partner will visit your location within 72 business hours from the delivery of the product.""}, {""value""=>""1 Sofa Bed""}, {""key""=>""Brand"", ""value""=>""FabHomeDecor""}, {""key""=>""Mattress Included"", ""value""=>""No""}, {""key""=>""Delivery Condition"", ""value""=>""Knock Down""}, {""key""=>""Storage Included"", ""value""=>""No""}, {""key""=>""Mechanism Type"", ""value""=>""Pull Out""}, {""key""=>""Type"", ""value""=>""Sofa Bed""}, {""key""=>""Style"", ""value""=>""Contemporary and Modern""}, {""key""=>""Filling Material"", ""value""=>""Microfiber""}, {""key""=>""Seating Capacity"", ""value""=>""3 Seater""}, {""key""=>""Upholstery Type"", ""value""=>""NA""}, {""key""=>""Upholstery Included"", ""value""=>""No""}, {""key""=>""Bed Size"", ""value""=>""Double""}, {""key""=>""Shape"", ""value""=>""Square""}, {""key""=>""Suitable For"", ""value""=>""Living Room""}, {""key""=>""Model Number"", ""value""=>""FHD132""}, {""key""=>""Care Instructions"", ""value""=>""Avoid outdoor use and exposure to water or prolonged moisture, Avoid exposure to direct heat or sunlight as this can cause the sofa colour to fade, Keep sharp objects away from your sofa, A little tear on the fabric cover may be hard to repair, Vacuum your sofas periodically with a soft bristled bru...View More Avoid outdoor use and exposure to water or prolonged moisture, Avoid exposure to direct heat or sunlight as this can cause the sofa colour to fade, Keep sharp objects away from your sofa, A little tear on the fabric cover may be hard to repair, Vacuum your sofas periodically with a soft bristled brush attachment or lightly brush them to keep general dirt and dust off the sofa and prevent any embedding between the fibres, Try to avoid food and drink spillage of any kind, If spills occur, do not leave unattended, In case of a stain, a water-free fabric cleaner can be used, However, avoid applying the cleaner directly on the stain as this can cause damage to the fabric and fade colour, Pour the cleaner onto a clean cloth and test its effect on a hidden area of the sofa before cleaning the stain with the cloth, A professional scotchguard treatment is one of the easiest and most effective options to protect against spills or stains and keep pet hair at bay, Getting your sofa professionally cleaned once every 6-8 months will not only take care of the nooks and corners that you can't reach, it will also make it more durable""}, {""key""=>""Finish Type"", ""value""=>""Matte""}, {""value""=>""Cancellation NOT allowed for this product after 24 hrs of order booking.""}, {""value""=>""- The color of the product may vary slightly compared to the picture displayed on your screen. This is due to lighting, pixel quality and color settings - Please check the product's dimensions to ensure the product will fit in the desired location. Also, check if the product will fit through...View More - The color of the product may vary slightly compared to the picture displayed on your screen. This is due to lighting, pixel quality and color settings - Please check the product's dimensions to ensure the product will fit in the desired location. Also, check if the product will fit through the entrance(s) and door(s) of the premises - Please expect an unevenness of up to 5 mm in the product due to differences in surfaces and floor levels - Flipkart, or the Seller delivering the product, will not take up any type of civil work, such as drilling holes in the wall to mount the product. The product will only be assembled in case carpentry assembly is required - In case the product appears to lack shine, wiping the surface with a cloth will help clear the surface of dust particles""}, {""key""=>""Covered in Warranty"", ""value""=>""Warranty covers all kind of manufacturing defects. Concerned product will either be repaired or replaced based on discretion.""}, {""key""=>""Service Type"", ""value""=>""Manufacturer Warranty""}, {""key""=>""Warranty Summary"", ""value""=>""6 Months Domestic Warranty""}, {""key""=>""Not Covered in Warranty"", ""value""=>""Warranty does not cover for Improper Handling""}, {""key""=>""Weight"", ""value""=>""40 kg""}, {""key""=>""Height"", ""value""=>""838 mm""}, {""key""=>""Width"", ""value""=>""1905 mm""}, {""key""=>""Depth"", ""value""=>""939 mm""}, {""key""=>""Upholstery Color"", ""value""=>""Purple""}, {""key""=>""Primary Color"", ""value""=>""Purple""}, {""key""=>""Primary Material"", ""value""=>""Fabric""}, {""key""=>""Secondary Material Subtype"", ""value""=>""Mango Wood""}, {""key""=>""Secondary Material"", ""value""=>""Foam""}, {""key""=>""Finish Color"", ""value""=>""Purple""}, {""key""=>""Primary Material Subtype"", ""value""=>""Foam""}]}"
c275ee5ac19f774a3ef7da71b40aabd8,2016-03-25 22:59:23 +0000,http://www.flipkart.com/style-foot-bellies/p/itmeh4fssgzabe5h?pid=SHOEH4FSHEDEMVTM,Style Foot Bellies,"[""Footwear >> Women's Footwear >> Ballerinas >> Style Foot Bellies""]",SHOEH4FSHEDEMVTM,899,449,"[""http://img5a.flixcart.com/image/shoe/p/f/h/black-sfwf0377-style-foot-44-original-imaeh4cxasyrdtjr.jpeg"", ""http://img5a.flixcart.com/image/shoe/v/t/m/black-sfwf0377-style-foot-43-original-imaeh4cx4c7w8nuc.jpeg"", ""http://img5a.flixcart.com/image/shoe/p/f/h/black-sfwf0377-style-foot-44-original-imaeh4cxyruxf2pr.jpeg"", ""http://img5a.flixcart.com/image/shoe/p/f/h/black-sfwf0377-style-foot-44-original-imaeh4cxzzcbeudz.jpeg"", ""http://img5a.flixcart.com/image/shoe/v/t/m/black-sfwf0377-style-foot-43-original-imaeh4cxvjpek25n.jpeg""]",false,"Key Features of Style Foot Bellies ballerina shoes ballerina flats,Style Foot Bellies Price: Rs. 449 ballet shoes that fits perfectly for casual and party wear,Specifications of Style Foot Bellies General Occasion Casual Ideal For Women Shoe Details Heel Height 1 inch Outer Material PU Color Black In the Box 1 slipper",No rating available,No rating available,Style Foot,"{""product_specification""=>[{""key""=>""Occasion"", ""value""=>""Casual""}, {""key""=>""Ideal For"", ""value""=>""Women""}, {""key""=>""Heel Height"", ""value""=>""1 inch""}, {""key""=>""Outer Material"", ""value""=>""PU""}, {""key""=>""Color"", ""value""=>""Black""}, {""value""=>""1 slipper""}]}"
4f3511c33a6869b1d5102cd97818ef00,2016-03-25 22:59:23 +0000,http://www.flipkart.com/carrel-printed-women-s/p/itmehf3hmxnuawtn?pid=SWIEHF3H7WG6VGMR,Carrel Printed Women's,"[""Clothing >> Women's Clothing >> Sports & Gym Wear >> Swimsuits >> Carrel Swimsuits >> Carrel Printed Women's""]",SWIEHF3H7WG6VGMR,2499,999,"[""http://img5a.flixcart.com/image/swimsuit/g/z/j/carrel-sw-3091-darkblue-white-carrel-4xl-original-imaehyzmk8hphgua.jpeg"", ""http://img6a.flixcart.com/image/swimsuit/g/z/j/carrel-sw-3091-darkblue-white-carrel-4xl-original-imaehyzmmgz3fgny.jpeg"", ""http://img6a.flixcart.com/image/swimsuit/g/z/j/carrel-sw-3091-darkblue-white-carrel-4xl-original-imaehyzmjgcfwacx.jpeg"", ""http://img6a.flixcart.com/image/swimsuit/g/z/j/carrel-sw-3091-darkblue-white-carrel-4xl-original-imaehyzms4b9k2vf.jpeg"", ""http://img6a.flixcart.com/image/swimsuit/g/z/j/carrel-sw-3091-darkblue-white-carrel-4xl-original-imaehyzmgf2j2yh4.jpeg""]",false,"Key Features of Carrel Printed Women's Fabric: SwimLycra Brand Color: DARK BLUE, WHITE,Carrel Printed Women's Price: Rs. 999 Max-coverage swimwear collection from CARREL BRAND, Brighten up your swim routine with this best fitting. This swimming costume from the house of Carrel is made of imported swim lycra fabric and comes in Darkblue & White Colour. It has to be washed separately and dry in shade. Attractive & classy caressing the water. This swimwear provides excellent protection and Chlorine resistance. fast drying combined with flatlock stitching gives an unmatched comfort and helps you to that performance you have been striving for. This swimwear with its comfort and style is your perfect companion at any pool, beach or water activity. Time for you to do your own thing and Go With The Flow. This Swimwear Lightly padded, for modesty and support. This Product Support To This Size : L, XL, XXL, 3XL,4XL.,Specifications of Carrel Printed Women's Top Details Neck Round Neck Swimsuit Details Fabric SwimLycra Type Swim-dress General Details Pattern Printed Ideal For Women's Occasion Sports Fabric Care Wash with Similar Colors, Use Detergent for Colors In the Box 1 Swimware",No rating available,No rating available,Carrel,"{""product_specification""=>[{""key""=>""Neck"", ""value""=>""Round Neck""}, {""key""=>""Fabric"", ""value""=>""SwimLycra""}, {""key""=>""Type"", ""value""=>""Swim-dress""}, {""key""=>""Pattern"", ""value""=>""Printed""}, {""key""=>""Ideal For"", ""value""=>""Women's""}, {""key""=>""Occasion"", ""value""=>""Sports""}, {""value""=>""Wash with Similar Colors, Use Detergent for Colors""}, {""value""=>""1 Swimware""}]}"
7ee3e337474a29b38cfe1f5d4020d633,2016-03-25 22:59:23 +0000,http://www.flipkart.com/fabhomedecor-fabric-double-sofa-bed/p/itmeh3qgqctxreu9?pid=SBEEH3QGWRGG3J6Q,FabHomeDecor Fabric Double Sofa Bed,"[""Furniture >> Living Room Furniture >> Sofa Beds & Futons >> FabHomeDecor Fabric Double Sofa Bed (Finish Colo...""]",SBEEH3QGWRGG3J6Q,32157,22646,"[""http://img6a.flixcart.com/image/sofa-bed/j/6/q/fhd115-double-foam-fabhomedecor-dark-brown-dark-brown-original-imaeh3gee5zcazvm.jpeg"", ""http://img5a.flixcart.com/image/sofa-bed/j/6/q/fhd115-double-foam-fabhomedecor-dark-brown-dark-brown-original-imaeh3gehqgbxhhq.jpeg"", ""http://img6a.flixcart.com/image/sofa-bed/j/6/q/fhd115-double-foam-fabhomedecor-dark-brown-dark-brown-original-imaeh3get5j5mqfw.jpeg"", ""http://img6a.flixcart.com/image/sofa-bed/j/6/q/fhd115-double-foam-fabhomedecor-dark-brown-dark-brown-original-imaeh3gezh3uxkux.jpeg"", ""http://img6a.flixcart.com/image/sofa-bed/j/6/q/fhd115-double-foam-fabhomedecor-dark-brown-dark-brown-original-imaeh3geexpwnmeb.jpeg""]",false,"FabHomeDecor Fabric Double Sofa Bed (Finish Color - Dark Brown Mechanism Type - Pull Out) Price: Rs. 22,646 • Fine deep seating experience • Save Space with the all new click clack Sofa Bed • Easy to fold and vice versa with simple click clack mechanism • Chrome legs with mango wood frame for long term durability • Double cushioned Sofa Bed to provide you with extra softness to make a fine seating experience • A double bed that can easily sleep two,Specifications of FabHomeDecor Fabric Double Sofa Bed (Finish Color - Dark Brown Mechanism Type - Pull Out) In The Box 1 Sofa Bed Installation & Demo Installation & Demo Details Installation and demo for this product is done free of cost as part of this purchase. Our service partner will visit your location within 72 business hours from the delivery of the product. Important Note Cancellation NOT allowed for this product after 24 hrs of order booking. General Brand FabHomeDecor Mattress Included No Delivery Condition Knock Down Storage Included No Mechanism Type Pull Out Type Sofa Bed Style Contemporary & Modern Filling Material Microfiber Seating Capacity 3 Seater Upholstery Type NA Upholstery Included No Bed Size Double Shape Square Suitable For Living Room Model Number FHD115 Finish Type Matte Care Instructions Avoid outdoor use and exposure to water or prolonged moisture, Avoid exposure to direct heat or sunlight as this can cause the sofa colour to fade, Keep sharp objects away from your sofa, A little tear on the fabric cover may be hard to repair, Vacuum your sofas periodically with a soft bristled bru...View More Avoid outdoor use and exposure to water or prolonged moisture, Avoid exposure to direct heat or sunlight as this can cause the sofa colour to fade, Keep sharp objects away from your sofa, A little tear on the fabric cover may be hard to repair, Vacuum your sofas periodically with a soft bristled brush attachment or lightly brush them to keep general dirt and dust off the sofa and prevent any embedding between the fibres, Try to avoid food and drink spillage of any kind, If spills occur, do not leave unattended, In case of a stain, a water-free fabric cleaner can be used, However, avoid applying the cleaner directly on the stain as this can cause damage to the fabric and fade colour, Pour the cleaner onto a clean cloth and test its effect on a hidden area of the sofa before cleaning the stain with the cloth, A professional scotchguard treatment is one of the easiest and most effective options to protect against spills or stains and keep pet hair at bay, Getting your sofa professionally cleaned once every 6-8 months will not only take care of the nooks and corners that you can't reach, it will also make it more durable Dimensions Weight 40 kg Height 838.2 mm Width 1905 mm Depth 939.8 mm Warranty Covered in Warranty Warranty covers all kind of manufacturing defects. Concerned product will either be repaired or replaced based on discretion. Warranty Summary 6 Months Domestic Warranty Service Type Manufacturer Warranty Not Covered in Warranty Warranty does not cover for Improper Handling Disclaimer - The color of the product may vary slightly compared to the picture displayed on your screen. This is due to lighting, pixel quality and color settings - Please check the product's dimensions to ensure the product will fit in the desired location. Also, check if the product will fit through...View More - The color of the product may vary slightly compared to the picture displayed on your screen. This is due to lighting, pixel quality and color settings - Please check the product's dimensions to ensure the product will fit in the desired location. Also, check if the product will fit through the entrance(s) and door(s) of the premises - Please expect an unevenness of up to 5 mm in the product due to differences in surfaces and floor levels - Flipkart, or the Seller delivering the product, will not take up any type of civil work, such as drilling holes in the wall to mount the product. The product will only be assembled in case carpentry assembly is required - In case the product appears to lack shine, wiping the surface with a cloth will help clear the surface of dust particles Material & Color Primary Material Fabric Primary Color Brown Upholstery Color Dark Brown Secondary Material Foam Secondary Material Subtype Mango Wood Finish Color Dark Brown Primary Material Subtype Foam",No rating available,No rating available,FabHomeDecor,"{""product_specification""=>[{""value""=>""1 Sofa Bed""}, {""key""=>""Installation & Demo Details"", ""value""=>""Installation and demo for this product is done free of cost as part of this purchase. Our service partner will visit your location within 72 business hours from the delivery of the product.""}, {""value""=>""Cancellation NOT allowed for this product after 24 hrs of order booking.""}, {""value""=>""- The color of the product may vary slightly compared to the picture displayed on your screen. This is due to lighting, pixel quality and color settings - Please check the product's dimensions to ensure the product will fit in the desired location. Also, check if the product will fit through...View More - The color of the product may vary slightly compared to the picture displayed on your screen. This is due to lighting, pixel quality and color settings - Please check the product's dimensions to ensure the product will fit in the desired location. Also, check if the product will fit through the entrance(s) and door(s) of the premises - Please expect an unevenness of up to 5 mm in the product due to differences in surfaces and floor levels - Flipkart, or the Seller delivering the product, will not take up any type of civil work, such as drilling holes in the wall to mount the product. The product will only be assembled in case carpentry assembly is required - In case the product appears to lack shine, wiping the surface with a cloth will help clear the surface of dust particles""}, {""key""=>""Brand"", ""value""=>""FabHomeDecor""}, {""key""=>""Mattress Included"", ""value""=>""No""}, {""key""=>""Delivery Condition"", ""value""=>""Knock Down""}, {""key""=>""Storage Included"", ""value""=>""No""}, {""key""=>""Mechanism Type"", ""value""=>""Pull Out""}, {""key""=>""Type"", ""value""=>""Sofa Bed""}, {""key""=>""Style"", ""value""=>""Contemporary and Modern""}, {""key""=>""Filling Material"", ""value""=>""Microfiber""}, {""key""=>""Seating Capacity"", ""value""=>""3 Seater""}, {""key""=>""Upholstery Type"", ""value""=>""NA""}, {""key""=>""Upholstery Included"", ""value""=>""No""}, {""key""=>""Bed Size"", ""value""=>""Double""}, {""key""=>""Shape"", ""value""=>""Square""}, {""key""=>""Suitable For"", ""value""=>""Living Room""}, {""key""=>""Model Number"", ""value""=>""FHD115""}, {""key""=>""Finish Type"", ""value""=>""Matte""}, {""key""=>""Care Instructions"", ""value""=>""Avoid outdoor use and exposure to water or prolonged moisture, Avoid exposure to direct heat or sunlight as this can cause the sofa colour to fade, Keep sharp objects away from your sofa, A little tear on the fabric cover may be hard to repair, Vacuum your sofas periodically with a soft bristled bru...View More Avoid outdoor use and exposure to water or prolonged moisture, Avoid exposure to direct heat or sunlight as this can cause the sofa colour to fade, Keep sharp objects away from your sofa, A little tear on the fabric cover may be hard to repair, Vacuum your sofas periodically with a soft bristled brush attachment or lightly brush them to keep general dirt and dust off the sofa and prevent any embedding between the fibres, Try to avoid food and drink spillage of any kind, If spills occur, do not leave unattended, In case of a stain, a water-free fabric cleaner can be used, However, avoid applying the cleaner directly on the stain as this can cause damage to the fabric and fade colour, Pour the cleaner onto a clean cloth and test its effect on a hidden area of the sofa before cleaning the stain with the cloth, A professional scotchguard treatment is one of the easiest and most effective options to protect against spills or stains and keep pet hair at bay, Getting your sofa professionally cleaned once every 6-8 months will not only take care of the nooks and corners that you can't reach, it will also make it more durable""}, {""key""=>""Weight"", ""value""=>""40 kg""}, {""key""=>""Height"", ""value""=>""838.2 mm""}, {""key""=>""Width"", ""value""=>""1905 mm""}, {""key""=>""Depth"", ""value""=>""939.8 mm""}, {""key""=>""Covered in Warranty"", ""value""=>""Warranty covers all kind of manufacturing defects. Concerned product will either be repaired or replaced based on discretion.""}, {""key""=>""Warranty Summary"", ""value""=>""6 Months Domestic Warranty""}, {""key""=>""Service Type"", ""value""=>""Manufacturer Warranty""}, {""key""=>""Not Covered in Warranty"", ""value""=>""Warranty does not cover for Improper Handling""}, {""key""=>""Primary Material"", ""value""=>""Fabric""}, {""key""=>""Primary Color"", ""value""=>""Brown""}, {""key""=>""Upholstery Color"", ""value""=>""Dark Brown""}, {""key""=>""Secondary Material"", ""value""=>""Foam""}, {""key""=>""Secondary Material Subtype"", ""value""=>""Mango Wood""}, {""key""=>""Finish Color"", ""value""=>""Dark Brown""}, {""key""=>""Primary Material Subtype"", ""value""=>""Foam""}]}"
