uniq_id,crawl_timestamp,product_url,product_name,product_category_tree,pid,retail_price,discounted_price,image,is_FK_Advantage_product,description,product_rating,overall_rating,brand,product_specifications
f35f27525ab8f5988d3817ee9bb02ce1,2016-03-25 22:59:23 +0000,http://www.flipkart.com/sicons-conditioning-conditoner-dog-shampoo/p/itmeh3zxdz5zzgpz?pid=PSOEH3ZXRTZJUVXM,Sicons Conditioning Conditoner Dog Shampoo,"[""Pet Supplies >> Grooming >> Skin & Coat Care >> Shampoo >> Sicons Conditioning Conditoner Dog Shampoo (200 ml)""]",PSOEH3ZXRTZJUVXM,110,100,"[""http://img6a.flixcart.com/image/pet-shampoo/v/x/m/sh-df-02-sicons-200-1100x1100-imaeh3kjba4htqfg.jpeg"", ""http://img5a.flixcart.com/image/pet-shampoo/v/x/m/sh-df-02-sicons-200-original-imaeh3kjba4htqfg.jpeg""]",false,Specifications of Sicons Conditioning Conditoner Dog Shampoo (200 ml) General Pet Type Dog Brand Sicons Quantity 200 ml Model Number SH.DF-02 Type Conditioning Fragrance Conditoner Form Factor Gel In the Box Sales Package Shampoo Sicons Dog Fashion Conditioner Aloe Rinse,No rating available,No rating available,Sicons,"{""product_specification""=>[{""key""=>""Pet Type"", ""value""=>""Dog""}, {""key""=>""Brand"", ""value""=>""Sicons""}, {""key""=>""Quantity"", ""value""=>""200 ml""}, {""key""=>""Model Number"", ""value""=>""SH.DF-02""}, {""key""=>""Type"", ""value""=>""Conditioning""}, {""key""=>""Fragrance"", ""value""=>""Conditoner""}, {""key""=>""Form Factor"", ""value""=>""Gel""}, {""key""=>""Sales Package"", ""value""=>""Shampoo Sicons Dog Fashion Conditioner Aloe Rinse""}]}"
ea98a65ad1e1b8688eddf89fbc7b3e27,2016-03-25 22:59:23 +0000,http://www.flipkart.com/alisha-solid-women-s-cycling-shorts/p/itmeh2fdc4esfsym?pid=SRTEH2FD3ANFFMHP,Alisha Solid Women's Cycling Shorts,"[""Clothing >> Women's Clothing >> Lingerie, Sleep & Swimwear >> Shorts >> Alisha Shorts >> Alisha Solid Women's Cycling Shorts""]",SRTEH2FD3ANFFMHP,,,"[""http://img6a.flixcart.com/image/short/m/g/y/altht-3p-18-alisha-34-original-imaeh2d5zgnh6vsb.jpeg"", ""http://img5a.flixcart.com/image/short/m/g/y/altht-3p-18-alisha-34-original-imaeh2d5zgnh6vsb.jpeg"", ""http://img6a.flixcart.com/image/short/p/h/t/altht-3p-1-alisha-34-original-imaeh2d5jxvh4msy.jpeg"", ""http://img6a.flixcart.com/image/short/p/h/t/altht-3p-1-alisha-34-original-imaeh2d5yz9fcjxe.jpeg"", ""http://img6a.flixcart.com/image/short/p/h/t/altht-3p-1-alisha-34-original-imaeh2d5fa94gzuy.jpeg"", ""http://img5a.flixcart.com/image/short/z/j/7/altght-7-alisha-38-original-imaeh2d5jsz2ghd6.jpeg""]",false,"Alisha Solid Women's Cycling Shorts - Buy Black, White, Navy Alisha Solid Women's Cycling Shorts For Only Rs. 999 Online in India. Shop Online For Apparels. Huge Collection of Branded Clothes Only at Flipkart.com",No rating available,No rating available,Alisha,
7a7ba93ab20a2b50fd5a7dc74bcba063,2016-03-31 15:22:07 +0000,http://www.flipkart.com/dongli-printed-boy-s-round-neck-t-shirt/p/itmehbhxtchxzghk?pid=TSHEHBHSKBJWHFNF,dongli Printed Boy's Round Neck T-Shirt,"[""Clothing >> Kids' Clothing >> Boys Wear >> Polos & T-Shirts >> dongli Polos & T-Shirts >> dongli Printed Boy's Round Neck T-Shirt (Pack of 4)""]",TSHEHBHSKBJWHFNF,2400,1039,"[""http://img5a.flixcart.com/image/t-shirt/w/x/t/dlhbb445-beige-black-gyellow-purple-dongli-10-11-years-original-imaehb54gxhchxcd.jpeg"", ""http://img6a.flixcart.com/image/t-shirt/w/x/t/dlhbb445-beige-black-gyellow-purple-dongli-10-11-years-original-imaehb54gxhchxcd.jpeg"", ""http://img5a.flixcart.com/image/t-shirt/f/n/f/dlhbb445-beige-black-gyellow-purple-dongli-15-16-years-original-imaehb55kjd6g4kg.jpeg"", ""http://img6a.flixcart.com/image/t-shirt/g/y/5/dlhbb445-beige-black-gyellow-purple-dongli-12-13-years-original-imaehb54re656maf.jpeg""]",false,"Specifications of dongli Printed Boy's Round Neck T-Shirt (Pack of 4) T-shirt Details Sleeve Half Sleeve Number of Contents in Sales Package Pack of 4 Fabric Cotton Type Round Neck Fit Regular General Details Pattern Printed Occasion Casual Ideal For Boy's In the Box 4 T Shirt Additional Details Style Code DLHBB445_BEIGE_BLACK_GYELLOW_PURPLE Fabric Care Wash with Similar Colors, Use Detergent for Colors",No rating available,No rating available,dongli,"{""product_specification""=>[{""key""=>""Sleeve"", ""value""=>""Half Sleeve""}, {""key""=>""Number of Contents in Sales Package"", ""value""=>""Pack of 4""}, {""key""=>""Fabric"", ""value""=>""Cotton""}, {""key""=>""Type"", ""value""=>""Round Neck""}, {""key""=>""Fit"", ""value""=>""Regular""}, {""key""=>""Pattern"", ""value""=>""Printed""}, {""key""=>""Occasion"", ""value""=>""Casual""}, {""key""=>""Ideal For"", ""value""=>""Boy's""}, {""value""=>""4 T Shirt""}, {""key""=>""Style Code"", ""value""=>""DLHBB445_BEIGE_BLACK_GYELLOW_PURPLE""}, {""value""=>""Wash with Similar Colors, Use Detergent for Colors""}]}"
9c26a5d85a59d6a34a199ae1df836ec3,2016-03-31 15:22:07 +0000,http://www.flipkart.com/swagga-women-clogs/p/itmeh75zqupd8scy?pid=SNDEH75ZFZ5REGFH,SWAGGA Women Clogs,"[""Footwear >> Women's Footwear >> Sports Sandals >> SWAGGA Women Clogs""]",SNDEH75ZFZ5REGFH,1500,1500,"[""http://img6a.flixcart.com/image/sandal/h/7/v/brown-white17-swagga0040-swagga-47-original-imaeh6zhxgymnwjx.jpeg"", ""http://img5a.flixcart.com/image/sandal/h/7/v/brown-white17-swagga0040-swagga-47-original-imaeh6zhxgymnwjx.jpeg"", ""http://img5a.flixcart.com/image/sandal/e/f/6/brown-black001-swagga0025-swagga-36-original-imaeh6zhsqwh8gaz.jpeg""]",false,"Key Features of SWAGGA Women Clogs Occasion: Ethnic Material: Leather Color: Brown, White Heel Height: 0,Specifications of SWAGGA Women Clogs General Occasion Ethnic Ideal For Women Sandal Details Type Clogs Heel Height 0 inch Outer Material Leather Color Brown, White13",No rating available,No rating available,SWAGGA,"{""product_specification""=>[{""key""=>""Occasion"", ""value""=>""Ethnic""}, {""key""=>""Ideal For"", ""value""=>""Women""}, {""key""=>""Type"", ""value""=>""Clogs""}, {""key""=>""Heel Height"", ""value""=>""0 inch""}, {""key""=>""Outer Material"", ""value""=>""Leather""}, {""key""=>""Color"", ""value""=>""Brown, White13""}]}"
20cf08ae845d5fd8f2b8cf52b3b9d840,2016-01-03 20:56:50 +0000,http://www.flipkart.com/kennel-rubber-dumbell-bell-small-toy-dog/p/itmea6sfmyuwwgjq?pid=PTYEA6SFGD4X8NAR,Kennel Rubber Dumbell With Bell - Small Rubber Rubber Toy For Dog,"[""Pet Supplies >> Toys >> Comfort Toys""]",PTYEA6SFGD4X8NAR,190,190,"[""http://img5a.flixcart.com/image/pet-toy/n/a/r/a35-kennel-original-imaea5c3qxyqzrgz.jpeg""]",false,Buy Kennel Rubber Dumbell With Bell - Small Rubber Rubber Toy For Dog for Rs.190 online. Kennel Rubber Dumbell With Bell - Small Rubber Rubber Toy For Dog at best prices with FREE shipping & cash on delivery. Only Genuine Products. 30 Day Replacement Guarantee.,No rating available,No rating available,Kennel,"{""product_specification""=>[{""key""=>""Pet Type"", ""value""=>""Dog""}, {""key""=>""Brand"", ""value""=>""Kennel""}, {""key""=>""Suitable For"", ""value""=>""Adult, Young""}, {""key""=>""Activity Type"", ""value""=>""Training""}, {""key""=>""Model Number"", ""value""=>""A35""}, {""key""=>""Type"", ""value""=>""Rubber Toy""}, {""key""=>""Model Name"", ""value""=>""Rubber Dumbell With Bell - Small""}, {""key""=>""Material"", ""value""=>""Rubber""}, {""key""=>""Chewable"", ""value""=>""No""}, {""key""=>""Color"", ""value""=>""Multicolor""}, {""key""=>""Weight"", ""value""=>""159 g""}, {""key""=>""Sales Package"", ""value""=>""Hard Toy""}, {""key""=>""Pack of"", ""value""=>""1""}]}"
bb41283056536d7af11e994ba4f9db81,2016-01-03 20:56:50 +0000,http://www.flipkart.com/glus-wedding-lingerie-set/p/itme92u9hecg3cyy?pid=LINE92U9KGZG25AY,Glus Wedding Lingerie Set,"[""Clothing >> Women's Clothing >> Lingerie, Sleep & Swimwear >> Lingerie Sets >> Glus Lingerie Sets""]",LINE92U9KGZG25AY,1299,699,"[""http://img5a.flixcart.com/image/lingerie-set/5/a/y/gp2151itu-glus-30b-original-imae92gzdcyhz9kr.jpeg"", ""http://img6a.flixcart.com/image/lingerie-set/m/w/z/gp2151ipu-glus-30b-original-imae92jf44ygzdhm.jpeg""]",false,Glus Wedding Lingerie Set - Buy Turquoise Glus Wedding Lingerie Set For Only Rs. 1299 Online in India. Shop Online For Apparels. Huge Collection of Branded Clothes Only at Flipkart.com,No rating available,No rating available,,"{""product_specification""=>[{""key""=>""Number of Contents in Sales Package"", ""value""=>""Pack of 1""}, {""key""=>""Fabric"", ""value""=>""Polyamide""}, {""key""=>""Type"", ""value""=>""Bra and Panty Set""}, {""key""=>""Function"", ""value""=>""Wedding""}, {""key""=>""Series"", ""value""=>""Fashion""}, {""key""=>""Style"", ""value""=>""Front Open Bra and Bikini Cut Back Mesh Panty""}, {""key""=>""Neck"", ""value""=>""V-neck""}, {""key""=>""Design"", ""value""=>""Racer Back With Strings . Balconette Underwire Oushup Thick Pad Bra and Designer Bikini Cut Panty.""}, {""key""=>""Pattern"", ""value""=>""Solid""}, {""key""=>""Ideal For"", ""value""=>""Women's""}, {""key""=>""Occasion"", ""value""=>""Wedding""}, {""key""=>""Cup Size"", ""value""=>""B""}, {""key""=>""Cup Type"", ""value""=>""Thick Padded Pushup Cups""}, {""value""=>""Wash With Similar Colors, Use Detergent For Colors""}, {""value""=>""Racer Back with strings , balconette underwire bar with front opening Bra. Designer bikini cut panty. String design at front and complete see through mesh at Back.""}, {""value""=>""Lingerie Set""}]}"
ea91e47cac68b132887d7fc1175e91c2,2016-01-03 20:56:50 +0000,http://www.flipkart.com/veelys-shiny-white-quad-roller-skates-size-4-5-uk/p/itmec88wuhjgzwur?pid=SKTEC88WSNYJKWY7,Veelys Shiny White Quad Roller Skates - Size 4.5 UK,"[""Sports & Fitness >> Other Sports >> Skating >> Skates >> Veelys Skates""]",SKTEC88WSNYJKWY7,3199,2499,"[""http://img6a.flixcart.com/image/skate/w/y/7/ve-ar-2132-w-4-5-1-veelys-quad-roller-shiny-white-original-imae5jpf8c5nmxfy.jpeg"", ""http://img5a.flixcart.com/image/skate/w/y/7/ve-ar-2132-w-4-5-1-veelys-quad-roller-shiny-white-original-imae5jpf8c5nmxfy.jpeg"", ""http://img5a.flixcart.com/image/skate/w/y/7/ve-ar-2132-w-4-5-1-veelys-quad-roller-shiny-white-original-imae5jpfqfgzvmzc.jpeg"", ""http://img6a.flixcart.com/image/skate/w/y/7/ve-ar-2132-w-4-5-1-veelys-quad-roller-shiny-white-original-imae5jp2jkbhx4gc.jpeg"", ""http://img5a.flixcart.com/image/skate/w/y/7/ve-ar-2132-w-4-5-1-veelys-quad-roller-shiny-white-original-imae5jp5swnmwnxz.jpeg"", ""http://img5a.flixcart.com/image/skate/w/y/7/ve-ar-2132-w-4-5-1-veelys-quad-roller-shiny-white-original-imae5jpyfbmh4m4r.jpeg""]",false,Veelys Shiny White Quad Roller Skates - Size 4.5 UK only for Rs 2499 . Ideal For Boys . Buy online @ Flipkart.com. Only Genuine Products. Free Shipping. Cash On Delivery!,No rating available,No rating available,,"{""product_specification""=>[{""key""=>""Playing Level"", ""value""=>""Advanced""}, {""key""=>""Age Group"", ""value""=>""4 - 18 Years""}, {""key""=>""Type"", ""value""=>""Quad Roller""}, {""key""=>""Ideal For"", ""value""=>""Boys""}, {""key""=>""Shoe Size"", ""value""=>""4.5 UK""}, {""key""=>""Weight"", ""value""=>""400 g""}, {""value""=>""NA""}, {""key""=>""Number of Contents in Sales Package"", ""value""=>""Pack of 1""}, {""key""=>""Sales Package"", ""value""=>""Pair Of Shoes""}, {""key""=>""Lining"", ""value""=>""No""}, {""key""=>""Closure Type"", ""value""=>""Automatic Rollers""}]}"
bec784ef794cf596dbe2cbbaf5427ef0,2016-01-03 20:56:50 +0000,http://www.flipkart.com/bulaky-vanity-case-jewellery/p/itmdzy4ycfjhvctj?pid=VANDZY4YZFPEG85T,Bulaky vanity case Jewellery Vanity Case,"[""Beauty and Personal Care >> Makeup >> Vanity Boxes >> Bulaky Vanity Boxes""]",VANDZY4YZFPEG85T,499,390,"[""http://img6a.flixcart.com/image/vanity-box/8/5/t/j-635-bulaky-vanity-case-1100x1100-imadzy6atzfswnag.jpeg"", ""http://img6a.flixcart.com/image/vanity-box/8/5/t/j-635-bulaky-vanity-case-original-imadzy6atzfswnag.jpeg"", ""http://img5a.flixcart.com/image/vanity-box/8/5/t/j-635-bulaky-vanity-case-original-imadzy6awxhnqxuy.jpeg""]",false,Buy Bulaky vanity case Jewellery Vanity Case for Rs.390 online. Bulaky vanity case Jewellery Vanity Case at best prices with FREE shipping & cash on delivery. Only Genuine Products. 30 Day Replacement Guarantee.,3,3,,"{""product_specification""=>{""key""=>""Body Material"", ""value""=>""croco leather material""}}"
171e0bcea390c17fd70e3ffa6c2cd187,2016-01-03 20:56:50 +0000,http://www.flipkart.com/fdt-women-s-leggings/p/itmeb2km9y7kdd6v?pid=LJGEB2KMCMMHHFC7,FDT Women's Leggings,"[""Clothing >> Women's Clothing >> Fusion Wear >> Leggings & Jeggings >> Legging Jegging >> FDT Legging Jegging""]",LJGEB2KMCMMHHFC7,699,309,"[""http://img6a.flixcart.com/image/legging-jegging/f/c/7/1-1-lg-green08-fdt-xl-original-imae58jpwqj5gh5e.jpeg"", ""http://img5a.flixcart.com/image/legging-jegging/f/c/7/1-1-lg-green08-fdt-xl-original-imae58jpfg5zmjmg.jpeg"", ""http://img6a.flixcart.com/image/legging-jegging/f/c/7/1-1-lg-green08-fdt-xl-original-imae58jpqzshhphj.jpeg""]",false,FDT Women's Leggings - Buy Parrot Green FDT Women's Leggings For Only Rs. 699 Online in India. Shop Online For Apparels. Huge Collection of Branded Clothes Only at Flipkart.com,No rating available,No rating available,,"{""product_specification""=>[{""key""=>""Number of Contents in Sales Package"", ""value""=>""Pack of 1""}, {""key""=>""Fabric"", ""value""=>""Cotton""}, {""key""=>""Type"", ""value""=>""Leggings""}, {""key""=>""Waistband"", ""value""=>""Elastic""}, {""key""=>""Pattern"", ""value""=>""Solid""}, {""key""=>""Ideal For"", ""value""=>""Women's""}, {""value""=>""Gentle Machine Wash in Lukewarm Water, Do Not Bleach""}]}"
a60ebb7803c6a31795de3f8949cb6f98,2016-01-03 20:56:50 +0000,http://www.flipkart.com/madcaps-c38gr30-men-s-cargos/p/itme6a53bczcafya?pid=CRGE6A53UX7CJMXX,Madcaps C38GR30 Men's Cargos,"[""Clothing >> Men's Clothing >> Cargos, Shorts & 3/4ths >> Cargos >> Madcaps Cargos""]",CRGE6A53UX7CJMXX,2199,1699,"[""http://img5a.flixcart.com/image/cargo/n/g/h/cargo-38-green-madcaps-34-original-imae5qgvt3fhqq33.jpeg"", ""http://img5a.flixcart.com/image/cargo/n/g/h/cargo-38-green-madcaps-34-original-imae5qgvbqb7whjq.jpeg"", ""http://img6a.flixcart.com/image/cargo/n/g/h/cargo-38-green-madcaps-34-original-imae5qgvzybrf3tt.jpeg"", ""http://img6a.flixcart.com/image/cargo/n/g/h/cargo-38-green-madcaps-34-original-imae5qgvehu5zuzb.jpeg"", ""http://img6a.flixcart.com/image/cargo/n/g/h/cargo-38-green-madcaps-34-original-imae5qgvhjzvfzcu.jpeg""]",false,Madcaps C38GR30 Men's Cargos - Buy Green Madcaps C38GR30 Men's Cargos For Only Rs. 2199 Online in India. Shop Online For Apparels. Huge Collection of Branded Clothes Only at Flipkart.com,No rating available,No rating available,,"{""product_specification""=>[{""key""=>""Number of Contents in Sales Package"", ""value""=>""Pack of 1""}, {""key""=>""Fabric"", ""value""=>""Cotton""}, {""key""=>""Fit"", ""value""=>""Relaxed Fit""}, {""key""=>""Pattern"", ""value""=>""Printed""}, {""key""=>""Ideal For"", ""value""=>""Men's""}, {""value""=>""Gentle Machine Wash in Lukewarm Water, Do Not Bleach, Do Not Tumble Dry, Cool Iron, Do Not Dry Clean, Wash And Iron Inside Out, Wash With Similar Colors, Use Detergent""}, {""key""=>""Style Code"", ""value""=>""CARGO 38 GREEN""}]}"
186d40c6852da91166c7eb7856603c51,2016-05-11 09:26:02 +0000,http://www.flipkart.com/bengal-blooms-rose-artificial-plant-pot/p/itmegdhsahxvv5km?pid=ARPEGDHSXZJSHGSN,Bengal Blooms Rose Artificial Plant  with Pot,"[""Bengal Blooms Rose Artificial Plant  with Pot (3...""]",ARPEGDHSXZJSHGSN,799,579,"[""http://img5a.flixcart.com/image/artificial-plant/g/s/n/bbajc218-bengal-blooms-original-imaeg8ety3zfcnvw.jpeg"", ""http://img6a.flixcart.com/image/artificial-plant/g/s/n/bbajc218-bengal-blooms-original-imaeg8ety3zfcnvw.jpeg""]",false,"Key Features of Bengal Blooms Rose Artificial Plant  with Pot Assorted Height: 30 cm,Bengal Blooms Rose Artificial Plant  with Pot (30 cm, Multicolor) Price: Rs. 579 The Bengal Blooms Decor your home with artificial flowers attached to a wonderful pot.,Specifications of Bengal Blooms Rose Artificial Plant  with Pot (30 cm, Multicolor) General Brand Bengal Blooms Model Number BBAJC218 Type Assorted Bonsai No Model Name Rose Color Multicolor Pot Features Pot Included Yes Dimensions Total Height 30 cm In the Box Sales Package 1 Assorted Artificial plant with Pot",No rating available,No rating available,Bengal Blooms,"{""product_specification""=>[{""key""=>""Brand"", ""value""=>""Bengal Blooms""}, {""key""=>""Model Number"", ""value""=>""BBAJC218""}, {""key""=>""Type"", ""value""=>""Assorted""}, {""key""=>""Bonsai"", ""value""=>""No""}, {""key""=>""Model Name"", ""value""=>""Rose""}, {""key""=>""Color"", ""value""=>""Multicolor""}, {""key""=>""Pot Included"", ""value""=>""Yes""}, {""key""=>""Total Height"", ""value""=>""30 cm""}, {""key""=>""Sales Package"", ""value""=>""1 Assorted Artificial plant with Pot""}]}"
e71017e224688489edfe856f2308806d,2016-06-24 16:24:13 +0000,http://www.flipkart.com/indcrown-net-embroidered-semi-stitched-lehenga-choli-material/p/itmejx2n25hczzvh?pid=FABEJX2NHNKCYHKA,Indcrown Net Embroidered Semi-stitched Lehenga Choli Material,"[""Clothing >> Women's Clothing >> Ethnic Wear >> Fabric >> Lehenga Choli Material >> Indcrown Lehenga Choli Material >> Indcrown Net Embroidered Semi-stitched Lehenga C...""]",FABEJX2NHNKCYHKA,999,699,"[""http://img5a.flixcart.com/image/fabric/h/k/a/r-c-lehe-bt-indcrown-1000x1000-imaejbczsqzjrbfd.jpeg"", ""http://img5a.flixcart.com/image/fabric/h/k/a/r-c-lehe-bt-indcrown-original-imaejbczsqzjrbfd.jpeg"", ""http://img6a.flixcart.com/image/fabric/h/k/a/r-c-lehe-bt-indcrown-original-imaejbczsqwbk8yz.jpeg"", ""http://img5a.flixcart.com/image/fabric/h/k/a/r-c-lehe-bt-indcrown-original-imaejbczy6tcpa3x.jpeg"", ""http://img5a.flixcart.com/image/fabric/u/g/e/w-nd-black-lehe-bt-indcrown-original-imaejbczrdg3464f.jpeg""]",false,"Key Features of Indcrown Net Embroidered Semi-stitched Lehenga Choli Material Ghagra Choli , Ghagra, Choli, Dupatta Set , Lehenga Choli , Lehenga, Choli and Dupatta Set .,Indcrown Net Embroidered Semi-stitched Lehenga Choli Material (Semi-stitched) Price: Rs. 699 We have not authorised any other seller to sell our brand Indcrown . Any seller doing so is selling fake Indcrown Products. Buy original Indcrown products from the seller "" indcrown‘’ only,Specifications of Indcrown Net Embroidered Semi-stitched Lehenga Choli Material (Semi-stitched) Fabric Details Fabric Net Type Semi-stitched Lehenga Choli Material General Details Pattern Embroidered Ideal For Women's Color Multicolor Fabric Care Dry clean or else Normal Hand Wash Additional Details Other Details Lehnga Choli is an Indian traditional ware also known as Chaniya Choli. We at Bolly Lounge offers you to attract compliments by this attractive Lehnga Choli made with fine quality material and beautiful work which can be worn for functions, festivals, parties and even office also. This Lehnga Choli ...View More Lehnga Choli is an Indian traditional ware also known as Chaniya Choli. We at Bolly Lounge offers you to attract compliments by this attractive Lehnga Choli made with fine quality material and beautiful work which can be worn for functions, festivals, parties and even office also. This Lehnga Choli is comes with unstitched material so it can be stitched according to your taste and preference. Stunning Self Designed Partywear Salwar Suit Gives A Trendy Look. Suit Having Fine Embroidery Work Over All. A Fine Fabric Used To Make It, It Will Be Comfortable In All Season. Style Code R C Lehe Bt In the Box 1 Lehenga Choli And Duppta Set",No rating available,No rating available,Indcrown,"{""product_specification""=>[{""key""=>""Fabric"", ""value""=>""Net""}, {""key""=>""Type"", ""value""=>""Semi-stitched Lehenga Choli Material""}, {""key""=>""Pattern"", ""value""=>""Embroidered""}, {""key""=>""Ideal For"", ""value""=>""Women's""}, {""key""=>""Color"", ""value""=>""Multicolor""}, {""value""=>""Dry clean or else Normal Hand Wash""}, {""key""=>""Other Details"", ""value""=>""Lehnga Choli is an Indian traditional ware also known as Chaniya Choli. We at Bolly Lounge offers you to attract compliments by this attractive Lehnga Choli made with fine quality material and beautiful work which can be worn for functions, festivals, parties and even office also. This Lehnga Choli ...View More Lehnga Choli is an Indian traditional ware also known as Chaniya Choli. We at Bolly Lounge offers you to attract compliments by this attractive Lehnga Choli made with fine quality material and beautiful work which can be worn for functions, festivals, parties and even office also. This Lehnga Choli is comes with unstitched material so it can be stitched according to your taste and preference. Stunning Self Designed Partywear Salwar Suit Gives A Trendy Look. Suit Having Fine Embroidery Work Over All. A Fine Fabric Used To Make It, It Will Be Comfortable In All Season.""}, {""key""=>""Style Code"", ""value""=>""R C Lehe Bt""}, {""value""=>""1 Lehenga Choli And Duppta Set""}]}"
6286847ee2da18f587503db49511c539,2016-06-24 16:24:13 +0000,http://www.flipkart.com/shopmania-music-band-a5-notebook-spiral-bound/p/itmej6z8xckfqbvt?pid=DIAEJ6Z8BEDTGGYY,Shopmania Music Band A5 Notebook Spiral Bound,"[""Pens & Stationery >> Diaries & Notebooks >> Notebooks >> Designer >> Shopmania Designer >> Shopmania Music Band A5 Notebook Spiral Bound (M...""]",DIAEJ6Z8BEDTGGYY,499,275,"[""http://img5a.flixcart.com/image/diary-notebook/g/y/y/shopmania-nb00664-1100x1100-imaej4wguh2c6dfb.jpeg"", ""http://img5a.flixcart.com/image/diary-notebook/g/y/y/shopmania-nb00664-original-imaej4wguh2c6dfb.jpeg""]",false,"Specifications of Shopmania Music Band A5 Notebook Spiral Bound (Multicolor) General Ruling Ruled Model id NB00664 Type Notebook GSM 75 Cover Type 300 GSM Hard Laminated Cover No. of Pages 160 Brand Name Shopmania Binding Spiral Bound Color Multicolor Size A5 Dimensions Length 9 inch Width 6 inch Special Features Can be used as Notepad, Diary, Writing pad In the Box Sales Package 1 Notebook",No rating available,No rating available,Shopmania,"{""product_specification""=>[{""key""=>""Ruling"", ""value""=>""Ruled""}, {""key""=>""Model id"", ""value""=>""NB00664""}, {""key""=>""Type"", ""value""=>""Notebook""}, {""key""=>""GSM"", ""value""=>""75""}, {""key""=>""Cover Type"", ""value""=>""300 GSM Hard Laminated Cover""}, {""key""=>""No. of Pages"", ""value""=>""160""}, {""key""=>""Brand Name"", ""value""=>""Shopmania""}, {""key""=>""Binding"", ""value""=>""Spiral Bound""}, {""key""=>""Color"", ""value""=>""Multicolor""}, {""key""=>""Size"", ""value""=>""A5""}, {""key""=>""Length"", ""value""=>""9 inch""}, {""key""=>""Width"", ""value""=>""6 inch""}, {""value""=>""Can be used as Notepad, Diary, Writing pad""}, {""key""=>""Sales Package"", ""value""=>""1 Notebook""}]}"
0686fec9b70e5039583a38119ca0c835,2016-06-24 16:24:13 +0000,http://www.flipkart.com/shopmania-music-band-a5-notebook-spiral-bound/p/itmej6z8tagp7gsy?pid=DIAEJ6Z8KQFWDEGH,Shopmania Music Band A5 Notebook Spiral Bound,"[""Pens & Stationery >> Diaries & Notebooks >> Notebooks >> Designer >> Shopmania Designer >> Shopmania Music Band A5 Notebook Spiral Bound (M...""]",DIAEJ6Z8KQFWDEGH,499,275,"[""http://img5a.flixcart.com/image/diary-notebook/e/g/h/shopmania-nb00678-1100x1100-imaej4whhbgzn5z3.jpeg"", ""http://img6a.flixcart.com/image/diary-notebook/e/g/h/shopmania-nb00678-original-imaej4whhbgzn5z3.jpeg""]",false,"Specifications of Shopmania Music Band A5 Notebook Spiral Bound (Multicolor) General Ruling Ruled Model id NB00678 Type Notebook GSM 75 Cover Type 300 GSM Hard Laminated Cover No. of Pages 160 Brand Name Shopmania Binding Spiral Bound Color Multicolor Size A5 Dimensions Length 9 inch Width 6 inch Special Features Can be used as Notepad, Diary, Writing pad In the Box Sales Package 1 Notebook",No rating available,No rating available,Shopmania,"{""product_specification""=>[{""key""=>""Ruling"", ""value""=>""Ruled""}, {""key""=>""Model id"", ""value""=>""NB00678""}, {""key""=>""Type"", ""value""=>""Notebook""}, {""key""=>""GSM"", ""value""=>""75""}, {""key""=>""Cover Type"", ""value""=>""300 GSM Hard Laminated Cover""}, {""key""=>""No. of Pages"", ""value""=>""160""}, {""key""=>""Brand Name"", ""value""=>""Shopmania""}, {""key""=>""Binding"", ""value""=>""Spiral Bound""}, {""key""=>""Color"", ""value""=>""Multicolor""}, {""key""=>""Size"", ""value""=>""A5""}, {""key""=>""Length"", ""value""=>""9 inch""}, {""key""=>""Width"", ""value""=>""6 inch""}, {""value""=>""Can be used as Notepad, Diary, Writing pad""}, {""key""=>""Sales Package"", ""value""=>""1 Notebook""}]}"
