uniq_id,crawl_timestamp,product_url,product_name,product_category_tree,pid,retail_price,discounted_price,image,is_FK_Advantage_product,description,product_rating,overall_rating,brand,product_specifications
c2d766ca982eca8304150849735ffef9,2016-03-25 22:59:23 +0000,http://www.flipkart.com/alisha-solid-women-s-cycling-shorts/p/itmeh2ffvzetthbb?pid=SRTEH2FF9KEDEFGF,Alisha Solid Women's Cycling Shorts,"[""Clothing >> Women's Clothing >> Lingerie, Sleep & Swimwear >> Shorts >> Alisha Shorts >> Alisha Solid Women's Cycling Shorts""]",SRTEH2FF9KEDEFGF,999,379,"[""http://img5a.flixcart.com/image/short/u/4/a/altht-3p-21-alisha-38-original-imaeh2d5vm5zbtgg.jpeg"", ""http://img5a.flixcart.com/image/short/p/j/z/altght4p-26-alisha-38-original-imaeh2d5kbufss6n.jpeg"", ""http://img5a.flixcart.com/image/short/p/j/z/altght4p-26-alisha-38-original-imaeh2d5npdybzyt.jpeg"", ""http://img5a.flixcart.com/image/short/z/j/7/altght-7-alisha-38-original-imaeh2d5jsz2ghd6.jpeg""]",false,"Key Features of Alisha Solid Women's Cycling Shorts Cotton Lycra Navy, Red, Navy,Specifications of Alisha Solid Women's Cycling Shorts Shorts Details Number of Contents in Sales Package Pack of 3 Fabric Cotton Lycra Type Cycling Shorts General Details Pattern Solid Ideal For Women's Fabric Care Gentle Machine Wash in Lukewarm Water, Do Not Bleach Additional Details Style Code ALTHT_3P_21 In the Box 3 shorts",No rating available,No rating available,Alisha,"{""product_specification""=>[{""key""=>""Number of Contents in Sales Package"", ""value""=>""Pack of 3""}, {""key""=>""Fabric"", ""value""=>""Cotton Lycra""}, {""key""=>""Type"", ""value""=>""Cycling Shorts""}, {""key""=>""Pattern"", ""value""=>""Solid""}, {""key""=>""Ideal For"", ""value""=>""Women's""}, {""value""=>""Gentle Machine Wash in Lukewarm Water, Do Not Bleach""}, {""key""=>""Style Code"", ""value""=>""ALTHT_3P_21""}, {""value""=>""3 shorts""}]}"
7f7036a6d550aaa89d34c77bd39a5e48,2016-03-25 22:59:23 +0000,http://www.flipkart.com/fabhomedecor-fabric-double-sofa-bed/p/itmeh3qgfamccfpy?pid=SBEEH3QGU7MFYJFY,FabHomeDecor Fabric Double Sofa Bed,"[""Furniture >> Living Room Furniture >> Sofa Beds & Futons >> FabHomeDecor Fabric Double Sofa Bed (Finish Colo...""]",SBEEH3QGU7MFYJFY,32157,22646,"[""http://img6a.flixcart.com/image/sofa-bed/j/f/y/fhd112-double-foam-fabhomedecor-leatherette-black-leatherette-1100x1100-imaeh3gemjjcg9ta.jpeg"", ""http://img6a.flixcart.com/image/sofa-bed/j/f/y/fhd112-double-foam-fabhomedecor-leatherette-black-leatherette-original-imaeh3gemjjcg9ta.jpeg"", ""http://img6a.flixcart.com/image/sofa-bed/j/f/y/fhd112-double-foam-fabhomedecor-leatherette-black-leatherette-original-imaeh3genfxkqvuv.jpeg"", ""http://img5a.flixcart.com/image/sofa-bed/j/f/y/fhd112-double-foam-fabhomedecor-leatherette-black-leatherette-original-imaeh3ge2sfeczef.jpeg"", ""http://img5a.flixcart.com/image/sofa-bed/j/f/y/fhd112-double-foam-fabhomedecor-leatherette-black-leatherette-original-imaeh3geuy7d74g2.jpeg"", ""http://img5a.flixcart.com/image/sofa-bed/j/f/y/fhd112-double-foam-fabhomedecor-leatherette-black-leatherette-original-imaeh3gerfhdxzwj.jpeg""]",false,"FabHomeDecor Fabric Double Sofa Bed (Finish Color - Leatherette Black Mechanism Type - Pull Out) Price: Rs. 22,646 • Fine deep seating experience • Save Space with the all new click clack Sofa Bed • Easy to fold and vice versa with simple click clack mechanism • Chrome legs with mango wood frame for long term durability • Double cushioned Sofa Bed to provide you with extra softness to make a fine seating experience • A double bed that can easily sleep two,Specifications of FabHomeDecor Fabric Double Sofa Bed (Finish Color - Leatherette Black Mechanism Type - Pull Out) Installation & Demo Installation & Demo Details Installation and demo for this product is done free of cost as part of this purchase. Our service partner will visit your location within 72 business hours from the delivery of the product. In The Box 1 Sofa Bed General Brand FabHomeDecor Mattress Included No Delivery Condition Knock Down Storage Included No Mechanism Type Pull Out Type Sofa Bed Style Contemporary & Modern Filling Material Microfiber Seating Capacity 3 Seater Upholstery Type NA Upholstery Included No Bed Size Double Shape Square Suitable For Living Room Model Number FHD112 Care Instructions Avoid outdoor use and exposure to water or prolonged moisture, Avoid exposure to direct heat or sunlight as this can cause the sofa colour to fade, Keep sharp objects away from your sofa, A little tear on the fabric cover may be hard to repair, Vacuum your sofas periodically with a soft bristled bru...View More Avoid outdoor use and exposure to water or prolonged moisture, Avoid exposure to direct heat or sunlight as this can cause the sofa colour to fade, Keep sharp objects away from your sofa, A little tear on the fabric cover may be hard to repair, Vacuum your sofas periodically with a soft bristled brush attachment or lightly brush them to keep general dirt and dust off the sofa and prevent any embedding between the fibres, Try to avoid food and drink spillage of any kind, If spills occur, do not leave unattended, In case of a stain, a water-free fabric cleaner can be used, However, avoid applying the cleaner directly on the stain as this can cause damage to the fabric and fade colour, Pour the cleaner onto a clean cloth and test its effect on a hidden area of the sofa before cleaning the stain with the cloth, A professional scotchguard treatment is one of the easiest and most effective options to protect against spills or stains and keep pet hair at bay, Getting your sofa professionally cleaned once every 6-8 months will not only take care of the nooks and corners that you can't reach, it will also make it more durable Finish Type Matte Important Note Cancellation NOT allowed for this product after 24 hrs of order booking. Warranty Covered in Warranty Warranty covers all kind of manufacturing defects. Concerned product will either be repaired or replaced based on discretion. Service Type Manufacturer Warranty Warranty Summary 6 Months Domestic Warranty Not Covered in Warranty Warranty does not cover for Improper Handling Dimensions Weight 40 kg Height 838 mm Width 1905 mm Depth 939 mm Disclaimer - The color of the product may vary slightly compared to the picture displayed on your screen. This is due to lighting, pixel quality and color settings - Please check the product's dimensions to ensure the product will fit in the desired location. Also, check if the product will fit through...View More - The color of the product may vary slightly compared to the picture displayed on your screen. This is due to lighting, pixel quality and color settings - Please check the product's dimensions to ensure the product will fit in the desired location. Also, check if the product will fit through the entrance(s) and door(s) of the premises - Please expect an unevenness of up to 5 mm in the product due to differences in surfaces and floor levels - Flipkart, or the Seller delivering the product, will not take up any type of civil work, such as drilling holes in the wall to mount the product. The product will only be assembled in case carpentry assembly is required - In case the product appears to lack shine, wiping the surface with a cloth will help clear the surface of dust particles Material & Color Upholstery Color Leatherette Black Primary Color Black Primary Material Fabric Secondary Material Subtype Mango Wood Secondary Material Foam Finish Color Leatherette Black Primary Material Subtype Foam",No rating available,No rating available,FabHomeDecor,"{""product_specification""=>[{""key""=>""Installation & Demo Details"", ""value""=>""Installation and demo for this product is done free of cost as part of this purchase. Our service partner will visit your location within 72 business hours from the delivery of the product.""}, {""value""=>""1 Sofa Bed""}, {""key""=>""Brand"", ""value""=>""FabHomeDecor""}, {""key""=>""Mattress Included"", ""value""=>""No""}, {""key""=>""Delivery Condition"", ""value""=>""Knock Down""}, {""key""=>""Storage Included"", ""value""=>""No""}, {""key""=>""Mechanism Type"", ""value""=>""Pull Out""}, {""key""=>""Type"", ""value""=>""Sofa Bed""}, {""key""=>""Style"", ""value""=>""Contemporary and Modern""}, {""key""=>""Filling Material"", ""value""=>""Microfiber""}, {""key""=>""Seating Capacity"", ""value""=>""3 Seater""}, {""key""=>""Upholstery Type"", ""value""=>""NA""}, {""key""=>""Upholstery Included"", ""value""=>""No""}, {""key""=>""Bed Size"", ""value""=>""Double""}, {""key""=>""Shape"", ""value""=>""Square""}, {""key""=>""Suitable For"", ""value""=>""Living Room""}, {""key""=>""Model Number"", ""value""=>""FHD112""}, {""key""=>""Care Instructions"", ""value""=>""Avoid outdoor use and exposure to water or prolonged moisture, Avoid exposure to direct heat or sunlight as this can cause the sofa colour to fade, Keep sharp objects away from your sofa, A little tear on the fabric cover may be hard to repair, Vacuum your sofas periodically with a soft bristled bru...View More Avoid outdoor use and exposure to water or prolonged moisture, Avoid exposure to direct heat or sunlight as this can cause the sofa colour to fade, Keep sharp objects away from your sofa, A little tear on the fabric cover may be hard to repair, Vacuum your sofas periodically with a soft bristled brush attachment or lightly brush them to keep general dirt and dust off the sofa and prevent any embedding between the fibres, Try to avoid food and drink spillage of any kind, If spills occur, do not leave unattended, In case of a stain, a water-free fabric cleaner can be used, However, avoid applying the cleaner directly on the stain as this can cause damage to the fabric and fade colour, Pour the cleaner onto a clean cloth and test its effect on a hidden area of the sofa before cleaning the stain with the cloth, A professional scotchguard treatment is one of the easiest and most effective options to protect against spills or stains and keep pet hair at bay, Getting your sofa professionally cleaned once every 6-8 months will not only take care of the nooks and corners that you can't reach, it will also make it more durable""}, {""key""=>""Finish Type"", ""value""=>""Matte""}, {""value""=>""Cancellation NOT allowed for this product after 24 hrs of order booking.""}, {""value""=>""- The color of the product may vary slightly compared to the picture displayed on your screen. This is due to lighting, pixel quality and color settings - Please check the product's dimensions to ensure the product will fit in the desired location. Also, check if the product will fit through...View More - The color of the product may vary slightly compared to the picture displayed on your screen. This is due to lighting, pixel quality and color settings - Please check the product's dimensions to ensure the product will fit in the desired location. Also, check if the product will fit through the entrance(s) and door(s) of the premises - Please expect an unevenness of up to 5 mm in the product due to differences in surfaces and floor levels - Flipkart, or the Seller delivering the product, will not take up any type of civil work, such as drilling holes in the wall to mount the product. The product will only be assembled in case carpentry assembly is required - In case the product appears to lack shine, wiping the surface with a cloth will help clear the surface of dust particles""}, {""key""=>""Covered in Warranty"", ""value""=>""Warranty covers all kind of manufacturing defects. Concerned product will either be repaired or replaced based on discretion.""}, {""key""=>""Service Type"", ""value""=>""Manufacturer Warranty""}, {""key""=>""Warranty Summary"", ""value""=>""6 Months Domestic Warranty""}, {""key""=>""Not Covered in Warranty"", ""value""=>""Warranty does not cover for Improper Handling""}, {""key""=>""Weight"", ""value""=>""40 kg""}, {""key""=>""Height"", ""value""=>""838 mm""}, {""key""=>""Width"", ""value""=>""1905 mm""}, {""key""=>""Depth"", ""value""=>""939 mm""}, {""key""=>""Upholstery Color"", ""value""=>""Leatherette Black""}, {""key""=>""Primary Color"", ""value""=>""Black""}, {""key""=>""Primary Material"", ""value""=>""Fabric""}, {""key""=>""Secondary Material Subtype"", ""value""=>""Mango Wood""}, {""key""=>""Secondary Material"", ""value""=>""Foam""}, {""key""=>""Finish Color"", ""value""=>""Leatherette Black""}, {""key""=>""Primary Material Subtype"", ""value""=>""Foam""}]}"
f449ec65dcbc041b6ae5e6a32717d01b,2016-03-25 22:59:23 +0000,http://www.flipkart.com/aw-bellies/p/itmeh4grgfbkexnt?pid=SHOEH4GRSUBJGZXE,AW Bellies,"[""Footwear >> Women's Footwear >> Ballerinas >> AW Bellies""]",SHOEH4GRSUBJGZXE,999,499,"[""http://img5a.flixcart.com/image/shoe/7/z/z/red-as-454-aw-11-original-imaeebfwsdf6jdf6.jpeg"", ""http://img6a.flixcart.com/image/shoe/7/z/z/red-as-454-aw-11-original-imaeebfwsdf6jdf6.jpeg"", ""http://img5a.flixcart.com/image/shoe/7/z/z/red-as-454-aw-11-original-imaeebfwt8zqc5cy.jpeg"", ""http://img5a.flixcart.com/image/shoe/7/z/z/red-as-454-aw-11-original-imaeebfwhz5f8v6m.jpeg"", ""http://img6a.flixcart.com/image/shoe/7/z/z/red-as-454-aw-11-original-imaeeducshzc6pbz.jpeg"", ""http://img6a.flixcart.com/image/shoe/7/z/z/red-as-454-aw-11-original-imaeebfw2veeuz8s.jpeg""]",false,"Key Features of AW Bellies Sandals Wedges Heel Casuals,AW Bellies Price: Rs. 499 Material: Synthetic Lifestyle: Casual Heel Type: Wedge Warranty Type: Manufacturer Product Warranty against manufacturing defects: 30 days Care instructions: Allow your pair of shoes to air and de-odorize at regular basis; use shoe bags to prevent any stains or mildew; dust any dry dirt from the surface using a clean cloth; do not use polish or shiner,Specifications of AW Bellies General Ideal For Women Occasion Casual Shoe Details Color Red Outer Material Patent Leather Heel Height 1 inch Number of Contents in Sales Package Pack of 1 In the Box One Pair Of Shoes",No rating available,No rating available,AW,"{""product_specification""=>[{""key""=>""Ideal For"", ""value""=>""Women""}, {""key""=>""Occasion"", ""value""=>""Casual""}, {""key""=>""Color"", ""value""=>""Red""}, {""key""=>""Outer Material"", ""value""=>""Patent Leather""}, {""key""=>""Heel Height"", ""value""=>""1 inch""}, {""key""=>""Number of Contents in Sales Package"", ""value""=>""Pack of 1""}, {""value""=>""One Pair Of Shoes""}]}"
0973b37acd0c664e3de26e97e5571454,2016-03-25 22:59:23 +0000,http://www.flipkart.com/alisha-solid-women-s-cycling-shorts/p/itmeh2f6sdgah2pq?pid=SRTEH2F6HUZMQ6SJ,Alisha Solid Women's Cycling Shorts,"[""Clothing >> Women's Clothing >> Lingerie, Sleep & Swimwear >> Shorts >> Alisha Shorts >> Alisha Solid Women's Cycling Shorts""]",SRTEH2F6HUZMQ6SJ,699,267,"[""http://img5a.flixcart.com/image/short/6/2/h/altght-11-alisha-38-original-imaeh2d5uq9thnyg.jpeg"", ""http://img6a.flixcart.com/image/short/p/h/t/altht-3p-1-alisha-34-original-imaeh2d5jxvh4msy.jpeg"", ""http://img6a.flixcart.com/image/short/p/h/t/altht-3p-1-alisha-34-original-imaeh2d5yz9fcjxe.jpeg"", ""http://img6a.flixcart.com/image/short/p/h/t/altht-3p-1-alisha-34-original-imaeh2d5fa94gzuy.jpeg"", ""http://img6a.flixcart.com/image/short/x/5/f/altght-2-alisha-36-original-imaeh2d5xnueazgz.jpeg""]",false,"Key Features of Alisha Solid Women's Cycling Shorts Cotton Lycra Black, Red,Specifications of Alisha Solid Women's Cycling Shorts Shorts Details Number of Contents in Sales Package Pack of 2 Fabric Cotton Lycra Type Cycling Shorts General Details Pattern Solid Ideal For Women's Fabric Care Gentle Machine Wash in Lukewarm Water, Do Not Bleach Additional Details Style Code ALTGHT_11 In the Box 2 shorts",No rating available,No rating available,Alisha,"{""product_specification""=>[{""key""=>""Number of Contents in Sales Package"", ""value""=>""Pack of 2""}, {""key""=>""Fabric"", ""value""=>""Cotton Lycra""}, {""key""=>""Type"", ""value""=>""Cycling Shorts""}, {""key""=>""Pattern"", ""value""=>""Solid""}, {""key""=>""Ideal For"", ""value""=>""Women's""}, {""value""=>""Gentle Machine Wash in Lukewarm Water, Do Not Bleach""}, {""key""=>""Style Code"", ""value""=>""ALTGHT_11""}, {""value""=>""2 shorts""}]}"
bc940ea42ee6bef5ac7cea3fb5cfbee7,2016-03-25 22:59:23 +0000,http://www.flipkart.com/sicons-all-purpose-arnica-dog-shampoo/p/itmeh3zyw2vhgsp5?pid=PSOEH3ZYDMSYARJ5,Sicons All Purpose Arnica Dog Shampoo,"[""Pet Supplies >> Grooming >> Skin & Coat Care >> Shampoo >> Sicons All Purpose Arnica Dog Shampoo (500 ml)""]",PSOEH3ZYDMSYARJ5,220,210,"[""http://img5a.flixcart.com/image/pet-shampoo/r/j/5/sh-df-14-sicons-500-1100x1100-imaeh3hfvav85tva.jpeg"", ""http://img5a.flixcart.com/image/pet-shampoo/r/j/5/sh-df-14-sicons-500-original-imaeh3hfvav85tva.jpeg""]",false,Specifications of Sicons All Purpose Arnica Dog Shampoo (500 ml) General Pet Type Dog Brand Sicons Quantity 500 ml Model Number SH.DF-14 Type All Purpose Fragrance Arnica Form Factor Liquid In the Box Sales Package Shampoo Sicons Dog Fashion Arnica,No rating available,No rating available,Sicons,"{""product_specification""=>[{""key""=>""Pet Type"", ""value""=>""Dog""}, {""key""=>""Brand"", ""value""=>""Sicons""}, {""key""=>""Quantity"", ""value""=>""500 ml""}, {""key""=>""Model Number"", ""value""=>""SH.DF-14""}, {""key""=>""Type"", ""value""=>""All Purpose""}, {""key""=>""Fragrance"", ""value""=>""Arnica""}, {""key""=>""Form Factor"", ""value""=>""Liquid""}, {""key""=>""Sales Package"", ""value""=>""Shampoo Sicons Dog Fashion Arnica""}]}"
c2a17313954882c1dba461863e98adf2,2016-03-25 22:59:23 +0000,http://www.flipkart.com/eternal-gandhi-super-series-crystal-paper-weights-silver-finish/p/itmeb7h2hrfgutxb?pid=PWTEB7H2E4KCYUE3,Eternal Gandhi Super Series Crystal Paper Weights  with Silver Finish,"[""Eternal Gandhi Super Series Crystal Paper Weight...""]",PWTEB7H2E4KCYUE3,430,430,"[""http://img5a.flixcart.com/image/paper-weight/u/e/3/eternal-gandhi-gandhi-paper-weight-mark-v-1100x1100-imaeb8adyf3xmqhf.jpeg"", ""http://img5a.flixcart.com/image/paper-weight/u/e/3/eternal-gandhi-gandhi-paper-weight-mark-v-original-imaeb8adyf3xmqhf.jpeg""]",false,"Key Features of Eternal Gandhi Super Series Crystal Paper Weights  with Silver Finish Crystal  paper weight Product Dimensions :   8cm x  8cm x 5cm A beautiful product Material: Crystal,Eternal Gandhi Super Series Crystal Paper Weights  with Silver Finish (Set Of 1, Clear) Price: Rs. 430 Your office desk will sparkle and shine when you accent tables with this elegant crystal paper weight. The multifaceted crystal features Gandhiji’s bust and his timeless message – “My life is my message – M.K. Gandhi”. A beautiful product to gift to your near and dear ones in family and Business.,Specifications of Eternal Gandhi Super Series Crystal Paper Weights  with Silver Finish (Set Of 1, Clear) General Model Name Gandhi Paper Weight Mark V Dimensions Weight 323 g In the Box Paper Weight Paper Weight Features Paper Weight Material Crystal Paper Weight Finish Silver Finish",No rating available,No rating available,Eternal Gandhi,"{""product_specification""=>[{""key""=>""Model Name"", ""value""=>""Gandhi Paper Weight Mark V""}, {""key""=>""Weight"", ""value""=>""323 g""}, {""value""=>""Paper Weight""}, {""key""=>""Paper Weight Material"", ""value""=>""Crystal""}, {""key""=>""Paper Weight Finish"", ""value""=>""Silver Finish""}]}"
ce5a6818f7707e2cb61fdcdbba61f5ad,2016-03-25 22:59:23 +0000,http://www.flipkart.com/alisha-solid-women-s-cycling-shorts/p/itmeh2ftwkzykhcg?pid=SRTEH2FVVKRBAXHB,Alisha Solid Women's Cycling Shorts,"[""Clothing >> Women's Clothing >> Lingerie, Sleep & Swimwear >> Shorts >> Alisha Shorts >> Alisha Solid Women's Cycling Shorts""]",SRTEH2FVVKRBAXHB,1199,479,"[""http://img6a.flixcart.com/image/short/p/j/z/altght4p-26-alisha-38-original-imaeh2d5cqtxe5gt.jpeg"", ""http://img5a.flixcart.com/image/short/z/j/7/altght-7-alisha-38-original-imaeh2d5jsz2ghd6.jpeg"", ""http://img5a.flixcart.com/image/short/p/j/z/altght4p-26-alisha-38-original-imaeh2d5kbufss6n.jpeg"", ""http://img5a.flixcart.com/image/short/p/j/z/altght4p-26-alisha-38-original-imaeh2d5npdybzyt.jpeg"", ""http://img6a.flixcart.com/image/short/x/5/f/altght-2-alisha-36-original-imaeh2d5xnueazgz.jpeg""]",false,"Key Features of Alisha Solid Women's Cycling Shorts Cotton Lycra Navy, Red, White, Red,Specifications of Alisha Solid Women's Cycling Shorts Shorts Details Number of Contents in Sales Package Pack of 4 Fabric Cotton Lycra Type Cycling Shorts General Details Pattern Solid Ideal For Women's In the Box 4 shorts Additional Details Style Code ALTGHT4P_26 Fabric Care Gentle Machine Wash in Lukewarm Water, Do Not Bleach",No rating available,No rating available,Alisha,"{""product_specification""=>[{""key""=>""Number of Contents in Sales Package"", ""value""=>""Pack of 4""}, {""key""=>""Fabric"", ""value""=>""Cotton Lycra""}, {""key""=>""Type"", ""value""=>""Cycling Shorts""}, {""key""=>""Pattern"", ""value""=>""Solid""}, {""key""=>""Ideal For"", ""value""=>""Women's""}, {""value""=>""4 shorts""}, {""key""=>""Style Code"", ""value""=>""ALTGHT4P_26""}, {""value""=>""Gentle Machine Wash in Lukewarm Water, Do Not Bleach""}]}"
